topic_id,record_id,title,abstract,is_relevant,et_rank,st_rank,et_score,st_score,bm25_score,minilm_score,specter_score,medcpt_score,category,gain_type
CD008691,2029013,Thallium stress testing does not predict cardiovascular risk in diabetic patients with end-stage renal disease undergoing cadaveric renal transplantation.,"PURPOSE: This study assessed the usefulness of thallium stress testing as a predictor of perioperative cardiovascular risk in diabetic patients with end-stage renal disease undergoing cadaveric renal transplantation. Demographic factors influencing the exercise performance in these patients were also examined. PATIENTS AND METHODS: The medical records of 189 consecutive patients with diabetic nephropathy who were evaluated for cadaveric renal transplantation were reviewed. Thallium stress testing was the initial examination of cardiovascular status in 141 patients. An adequate examination was one in which at least 70% of maximum heart rate was achieved. A thallium stress test was normal if there were no ST segment depressions on the electrocardiogram and no perfusion abnormalities on the thallium scan. Forty-four patients underwent cardiac catheterization as the initial evaluation (Group C) and four patients underwent transplantation without a formal cardiovascular evaluation (Group D). RESULTS: Sixty-four of the 141 patients undergoing thallium stress testing had an adequate and normal examination (Group A). The incidence of perioperative cardiac events in this group was 2%. Seventy-seven patients (Group B) had an abnormal (n = 41) or an inadequate (n = 36) thallium stress test and most (n = 61) then underwent coronary angiography. The use of beta-blockers was the only predictor of an abnormal or inadequate thallium stress test (10 of 64 versus 27 of 77, chi 2 = 6.66, p less than or equal to 0.025). Forty-three percent (26 of 61 in Group B) of patients with inadequate or abnormal thallium stress tests had significant coronary artery disease on cardiac catheterization. The perioperative risk of cardiac events was not different in Group A versus Groups B, C, and D combined. Survival of Group A and B patients was not different but was significantly longer than that of Group C patients (p less than 0.001). Thallium stress testing was less expensive than cardiac catheterization ($1,000 versus $4,000 to $5,000). CONCLUSIONS: Thallium stress testing allowed 45% of patients to avoid cardiac catheterization before renal transplantation. Discontinuing beta-blockers before thallium stress tests may improve exercise performance. The risk of perioperative cardiac events after transplantation was low and not different among patient groups. The relatively low predictive value of thallium stress testing for significant coronary artery disease and perioperative cardiac events in diabetic patients with end-stage renal disease suggests the need for the development of a more cost-effective, noninvasive screening test for this patient population.",1,21,194,0.8753886644700501,0.5670475363731384,234.3535755786652,0.5670475363731384,0.8456821441650391,0.7705938220024109,semantic_only_recovery,tar_augmented_et_gained
CD008691,2014921,Assessment of coronary artery disease by thallium scan in type-1 diabetic uremic patients awaiting combined pancreas and renal transplantation.,"Twenty-five type-1 diabetic uremic patients (14 men, 11 women, mean age forty +/- eleven years, range, nineteen to sixty) were prospectively analyzed for coronary artery disease (CAD) by thallium scan (TLS) before synchronus pancreas and kidney transplantation. Duration of diabetes ranged from ten to thirty-two years (mean twenty-two +/- five). Fifteen patients (60%) were in dialysis from two to sixty months (mean twenty +/- eighteen). Advanced diabetic degenerative complications were present in all patients. Twenty exercise and five pharmacologic thallium scans were performed. Forty-four percent of patients (6 men, 5 women, mean age forty-two +/- eleven years, range, twenty-six to sixty) had a positive (reversible or permanent defects) TLS. In 2/11 cases, severe CAD required further cardiac investigations for therapeutic management decision. A statistical correlation with resting ECG nonspecific ST-segment and T-wave abnormalities was observed (p less than 0.05) despite the absence of angor in 8 of the 11 patients. On the contrary, no statistical correlations were found regarding high blood pressure, smoking, hypercholesterolemia, duration of diabetes, and duration of dialysis. In this particular diabetic population (young age, male/female ratio = 1.2) with high incidence of silent ischemia, resting ECG repolarization abnormalities, though predictive, were not specific or prognostic of CAD severity; in these cases, exercise and pharmacologic TLS, a noninvasive and sensitive cardiovascular test, may be of great interest in diagnosis of CAD, allowing adequate cardiac management before, during, and after pancreas transplantation.",1,28,64,0.7804556767097581,0.6273342370986938,218.96941103534184,0.6273342370986938,0.882763147354126,0.7412591576576233,semantic_only_recovery,tar_augmented_et_gained
CD008691,14636911,Usefulness of tachycardic-stress perfusion imaging to predict coronary artery disease in high-risk patients with chronic renal failure.,"Uncertainty remains as to the most appropriate preoperative screening investigation to evaluate patient cardiac risk in prospective renal transplant recipients. We prospectively compared tachycardic-stress (exercise/pacing) scintigraphy with coronary angiography for the detection of significant coronary artery disease in this group. With a negative predictive value of 92%, tachycardic-stress scintigraphy may reduce the need for unnecessary coronary angiography in these patients.",1,41,72,0.7212996626046695,0.6224809885025024,131.96405806878855,0.6224809885025024,0.8785377144813538,0.7875968217849731,semantic_only_recovery,tar_augmented_et_gained
CD008691,9648086,Diagnostic accuracy and prognostic value of combined dipyridamole-exercise thallium imaging in hemodialysis patients.,"BACKGROUND: Non-invasive detection of coronary artery disease in dialysis patients, a major cause of mortality, often remains difficult. The aim of the study was to test the diagnostic and prognostic accuracies of combined dipyridamole-exercise thallium imaging in dialysis patients. METHODS: Dipyridamole-exercise thallium imaging and coronary angiography were both performed prospectively in 60 asymptomatic hemodialysis patients who were followed up, long term, by recording any major coronary event. RESULTS: Coronary angiography was abnormal in 13 patients (21%), and there was abnormal thallium uptake in 17 patients. Sensitivity, specificity, positive and negative predictive values, and overall accuracy of thallium to detect a coronary artery disease were 92, 89, 71, 98 and 90%, respectively. After a median follow-up of 2.8 years, 12 patients experienced at least one major coronary event (4 cardiac deaths, 5 myocardial infarctions and 3 revascularizations). Eight of the 17 patients with abnormal thallium uptake (47%) suffered a coronary event, compared to only 4 of the 43 patients (9%) with a normal thallium uptake (P < 0.001). The positive prognostic predictive value of thallium imaging was 47% and its negative predictive value was 91%. The probability of survival free of coronary events was significantly higher in patients with normal thallium uptake than in those with abnormal thallium uptake (crude risk ratio 7.6; P < 0.001) even after adjustment for several risk factors for cardiovascular disease (adjusted risk ratio 9.2; P < 0.005). CONCLUSION: In dialysis patients, combined dipyridamole-exercise thallium imaging is an accurate method for detecting coronary stenosis and for predicting future coronary events.",1,10,307,0.9213090127099628,0.5370112657546997,165.5363727606806,0.5370112657546997,0.8903820514678955,0.7886331081390381,semantic_only_recovery,tar_augmented_et_gained
CD008691,16640517,Validation of a screening protocol for identifying low-risk candidates with type 1 diabetes mellitus for kidney with or without pancreas transplantation.,"BACKGROUND: Certain clinical risk factors are associated with significant coronary artery disease in kidney transplant candidates with diabetes mellitus. We sought to validate the use of a clinical algorithm in predicting post-transplantation mortality in patients with type 1 diabetes. We also examined the prevalence of significant coronary lesions in high-risk transplant candidates. METHODS: All patients with type 1 diabetes evaluated between 1991 and 2001 for kidney with/without pancreas transplantation were classified as high-risk based on the presence of any of the following risk factors: age >or=45 yr, smoking history >or=5 pack years, diabetes duration >or=25 yr or any ST-T segment abnormalities on electrocardiogram. Remaining patients were considered low risk. All high-risk candidates were advised to undergo coronary angiography. The primary outcome of interest was all-cause mortality post-transplantation. RESULTS: Eighty-four high-risk and 42 low-risk patients were identified. Significant coronary artery stenosis was detected in 31 high-risk candidates. Mean arterial pressure was a significant predictor of coronary stenosis (odds ratio 1.68; 95% confidence interval 1.14-2.46), adjusted for age, sex and duration of diabetes. In 75 candidates who underwent transplantation with median follow-up of 47 months, the use of clinical risk factors predicted all eight deaths. No deaths occurred in low-risk patients. A significant mortality difference was noted between the two risk groups (p = 0.03). CONCLUSIONS: This clinical algorithm can identify patients with type 1 diabetes at risk for mortality after kidney with/without pancreas transplant. Patients without clinical risk factors can safely undergo transplantation without further cardiac evaluation.",1,48,79,0.681020075452017,0.6158474087715149,222.1108961907137,0.6158474087715149,0.8464648127555847,0.7355993986129761,semantic_only_recovery,tar_augmented_et_gained
CD008691,20349410,Myocardial scintigraphy and clinical stratification as predictors of events in renal transplant candidates.,"BACKGROUND: We tested the hypothesis that the universal application of myocardial scanning with single-photon emission computed tomography (SPECT) would result in better risk stratification in renal transplant candidates (RTC) compared with SPECT being restricted to patients who, in addition to renal disease, had other clinical risk factors. METHODS: RTCs (n=363) underwent SPECT and clinical risk stratification according to the American Society of Transplantation (AST) algorithm and were followed up until a major adverse cardiovascular event (MACE) or death. RESULTS: Of the 363 patients, 79 patients (22%) had an abnormal SPECT scan and 270 (74%) were classified as high risk. Both methods correctly identified patients with increased probability of MACE. However, clinical stratification performed better (sensitivity and negative predictive value 99% and 99% vs. 25% and 87%, respectively). High-risk patients with an abnormal SPECT scan had a modest increased risk of events (log-rank = 0.03; hazard ratio [HR] = 1.37; 95% confidence interval [95% CI], 1.02-1.82). Eighty-six patients underwent coronary angiography, and coronary artery disease (CAD) was found in 60%. High-risk patients with CAD had an increased incidence of events (log-rank = 0.008; HR=3.85; 95% CI, 1.46-13.22), but in those with an abnormal SPECT scan, the incidence of events was not influenced by CAD (log-rank = 0.23). Forty-six patients died. Clinical stratification, but not SPECT, correlated with the probability of death (log-rank = 0.02; HR=3.25; 95% CI, 1.31-10.82). CONCLUSION: SPECT should be restricted to high-risk patients. Moreover, in contrast to SPECT, the AST algorithm was also useful for predicting death by any cause in RTCs and for selecting patients for invasive coronary testing.",1,34,196,0.7483873517809703,0.5664050579071045,187.0558919294058,0.5664050579071045,0.878600537776947,0.7735167741775513,semantic_only_recovery,tar_augmented_et_gained
CD008691,9575401,Prognostic value of dipyridamole thallium-201 screening to minimize perioperative cardiac complications in diabetics undergoing kidney or kidney-pancreas transplantation.,"To minimize perioperative cardiac events, we utilize a screening protocol consisting of intravenous dipyridamole thallium-201 myocardial imaging (DPT), with the selective use of coronary angiography based on the presence of reversible defect(s) on DPT test. A retrospective study was performed to determine the prognostic value of this protocol and to identify any clinical parameters predictive of an abnormal DPT test. To accomplish this, a detailed chart analysis of 176 consecutive kidney (n = 89) and kidney-pancreas (n = 87) transplant recipients who had undergone pretransplant DPT testing was performed. The results of the DPT test were interpreted as normal in 111, fixed defect in 15, and reversible defect(s) in 50 patients. Forty-two of the 50 patients with reversible defect(s) underwent coronary angiography. Twelve of the 27 patients with significant coronary artery disease (CAD, > 50% stenosis in one or more coronary arteries) underwent pretransplant revascularization and the remaining 15 were treated medically. Cardiac events (documented acute myocardial infarction or sudden cardiac death) within 6 wk of transplant were stratified by the results of this protocol. Also, various clinical parameters were compared between patients with normal and abnormal (fixed and reversible defect) DPT tests. Only one of the 111 (0.9%) transplant recipients with a normal DPT test had a perioperative cardiac event. None of the 15 (0%) patients with a fixed defect and none of the 15 (0%) patients with reversible defect(s), but a nonsignificant (< 50% narrowing) coronary angiogram, had a perioperative cardiac event. Three of the 27 (11.1%) patients with reversible defect(s) and significant disease on coronary angiography, who had undergone pre-transplant revascularization or were managed medically, had a perioperative coronary event. Of 14 recipients parameters analyzed, age > 50 yr was the only variable predictive of an abnormal DPT test. We conclude that the incidence of perioperative cardiac events in patients with a normal or fixed defect, or reversible defect(s) but a nonsignificant (< 50% narrowing) coronary angiogram is very low, indicating the high correlation of these findings on DPT and an uneventful (cardiac) post-transplant course. The incidence of perioperative cardiac complications amongst the high-risk transplant recipients with reversible defect(s) and significant CAD on coronary angiogram may be minimized by appropriate preoperative medical management or revascularization. None of the clinical variables except age > 50 yr was predictive of an abnormal DPT test.",1,5,73,0.9463966972064376,0.6212537288665771,240.43183837085004,0.6212537288665771,0.8962106704711914,0.7775128483772278,semantic_only_recovery,tar_augmented_et_gained
CD008691,2353652,Prognostic value of intravenous dipyridamole thallium imaging in patients with diabetes mellitus considered for renal transplantation.,"Patients with diabetes and end-stage renal failure are known to have a high risk for cardiac morbidity and mortality associated with renal transplantation. The most efficient method to determine preoperative cardiac risk has not been established. To determine the effectiveness of intravenous dipyridamole thallium imaging in predicting cardiac events, 40 diabetic renal transplant candidates were studied preoperatively in a prospective trial. The study group consisted of 40 patients whose average age was 42 years (range 27 to 64); 34 (85%) were hypertensive and 21 (53%) were cigarette smokers. Cardiac history included chest pain in 6 patients and prior myocardial infarction in 3 patients. Dipyridamole thallium imaging showed reversible defects in 9 patients, fixed defects in 8 patients and normal scans in 23 patients. Dipyridamole thallium imaging was performed using 0.56 mg/kg of dipyridamole infused intravenously over 4 minutes. Cardiac events occurred only in patients with reversible thallium defects, of which there were 6. Of these 6 patients, 3 had cardiac events before transplantation and 3 had them in the early postoperative phase (within 6 weeks of surgery). Of 21 patients who underwent renal transplantation, 3 had cardiac events within 6 weeks of transplantation. The average duration of follow-up was 11 months (range 1 to 21). Thus, dipyridamole thallium imaging is an effective method of identifying renal transplant candidates likely to develop cardiac complications. Routine coronary angiography may not be necessary to screen all renal transplant candidates for coronary artery disease before surgery.",1,29,651,0.7617466188188898,0.4652819633483886,156.19455907947463,0.4652819633483886,0.8848348259925842,0.775351881980896,semantic_only_recovery,tar_augmented_et_gained
CD008691,2315467,Perfusion thallium imaging of type I diabetes patients with end stage renal disease: comparison of oral and intravenous dipyridamole administration.,"Eighty patients with type I diabetes and end stage renal disease were prospectively evaluated for coronary artery disease with dipyridamole-thallium-201 scintigraphy and quantitative coronary angiography. Forty patients received dipyridamole orally, and 40 received it intravenously. The prevalence of coronary artery disease was 53%. There were no significant differences in the accuracy of the two dipyridamole tests (sensitivity = 85%, specificity = 85%, accuracy = 85% for the oral group; sensitivity = 86%, specificity = 72%, accuracy = 79% for the intravenous group). Combining the 80 patients into a single group gave a sensitivity of 86%, a specificity of 79%, and an accuracy of 83% for the detection of coronary disease. Although the accuracy of this test in this patient population was similar to that previously reported for other groups, the prevalence of disease was high and resulted in a low predictive value of a negative test (83%).",1,31,371,0.7550621401113451,0.5207263231277466,182.3847562538215,0.5207263231277466,0.8685735464096069,0.7717539072036743,semantic_only_recovery,tar_augmented_et_gained
CD008691,2300998,Ineffectiveness of dipyridamole SPECT thallium imaging as a screening technique for coronary artery disease in patients with end-stage renal failure.,"The efficacy of dipyridamole single photon emission computed tomography (SPECT) thallium as a screening test for coronary artery disease (CAD), was studied in 45 patients with end-stage renal failure undergoing evaluation for renal transplantation. Coronary arteriography, dipyridamole SPECT thallium imaging and clinical follow-up were performed in all patients. Nineteen patients (42%) had an obstruction of 50% or more in at least one coronary artery. Fourteen patients had a positive thallium scan, but 7 of these were false-positives (sensitivity 37%, specificity 73%). The sensitivity was considerably lower than that quoted for non-ESRF patients in the literature, and significantly lower than a control group of 19 patients without ESRF having comparable severity and distribution of CAD. Five of the 6 patients who died of cardiac causes over a mean follow-up period of 25 months had normal thallium imaging, but all had significant coronary artery disease at cardiac catheterization. Dipyridamole SPECT thallium imaging has not proved a useful screening test for angiographically significant CAD, and does not predict cardiac prognosis in this population.",1,17,58,0.9088004265427228,0.6314840316772461,252.7315023952953,0.6314840316772461,0.9084850549697876,0.8117334246635437,semantic_only_recovery,tar_augmented_et_gained
CD008691,2226509,Cardiac evaluation of candidates for kidney transplantation: value of exercise radionuclide angiocardiography.,"In view of the high incidence and mortality of coronary artery disease (CAD) in patients with kidney transplantation, a systematic cardiac evaluation was prospectively performed in 103 uraemic patients eligible for transplantation. After clinical examination, 28 patients with symptoms of CAD or diabetes mellitus were referred directly for coronary angiography, whereas the remaining 75 patients had rest and exercise radionuclide angiocardiography for evaluation of possible asymptomatic CAD. Among them, left ventricular ejection fraction was below 40% at rest or fell during exercise by at least 5 EF% in 12 patients; coronary angiography in nine showed CAD in four and hypertensive heart disease in five. In the remaining 63 (of 75) patients without severe resting left ventricular dysfunction or exercise ischaemia, the follow-up of 28 +/- 7 months revealed no clinical manifestation of CAD. Overall incidence of CAD in symptomatic and asymptomatic patients during a follow-up of 27 months after cardiac evaluation was 20 and 25% in nondiabetic and diabetic candidates for kidney transplantation, respectively (P = n.s.). Thus, clinical examination combined with exercise radionuclide angiocardiography in patients without signs or symptoms of heart disease had a high predictive accuracy for presence or absence of late manifestations of CAD. Exercise radionuclide angiocardiography is therefore a useful method for screening kidney transplantation candidates for asymptomatic CAD.",1,44,122,0.6981438146330732,0.5900329947471619,213.84826632833784,0.5900329947471619,0.8942420482635498,0.7805586457252502,semantic_only_recovery,tar_augmented_et_gained
CD008691,19387250,The diagnostic and prognostic value of tissue Doppler imaging during dobutamine stress echocardiography in end-stage renal disease.,"OBJECTIVE: To determine whether a quantitative measurement of peak systolic velocity (PSV) during dobutamine stress echocardiography (DSE) detects severe coronary artery disease (CAD) and predicts mortality in patients with end-stage renal disease. METHODS: One hundred and forty renal transplant candidates had DSE and coronary angiography. DSE analysis was performed using conventional visual wall motion assessment, longitudinal PSV, and combining the two modalities. Failure of PSV to rise by more than 50% predicted an ischemic response. Significant CAD was defined as luminal stenosis greater than 70%. RESULTS: The number of positive DSE studies according to conventional, PSV, and combined criteria was 41 (30%), 42 (31%), and 46 (34%) respectively. Forty patients (29%) had significant CAD at angiography. The sensitivity, specificity, positive and negative predictive values for conventional DSE analysis were 84, 91, 86, and 90% respectively. The same values for PSV analysis were 86, 92, 86, and 91%, respectively. The same values for the combination of visual and PSV analysis were 88, 94, 87, and 92% respectively. The differences between the three methods were not statistically significant. Sensitivity for single-vessel CAD (P=0.05) and circumflex artery disease (P=0.05) diagnosis was higher with PSV compared with conventional DSE analysis. Failure of PSV to rise by more than 50% during DSE was associated with significantly increased mortality (P=0.001). CONCLUSION: A quantitative interpretation of DSE, based on the percentage rise of PSV during stress, accurately detects CAD and predicts prognosis in end-stage renal disease.",1,23,137,0.8520469458489323,0.584235668182373,151.1076100906611,0.584235668182373,0.8752316832542419,0.7774710655212402,semantic_only_recovery,tar_augmented_et_gained
CD008691,3532789,Evaluation of cardiovascular risk for renal transplantation in diabetic patients.,"Cardiovascular disease contributes in a major way to morbidity and mortality in diabetic patients with end-stage renal disease. Sixty patients with type I diabetes were evaluated prior to renal transplantation to determine the risk of cardiovascular complications. On the basis of results of thallium stress testing and/or cardiac catheterization, each patient was assigned to one of five categories. There were no cardiovascular events in the seven patients who had negative results on stress testing. Of the remaining 53 patients, all of whom underwent cardiac catheterization, 30 had normal coronary arteries. None of these 30 patients had any cardiac morbidity, and the two deaths that occurred in this group were not attributable to cardiac causes. Significant coronary artery disease was present in 38 percent of the patients. The overall mortality rate was 5.4 percent in those patients without coronary artery disease and 43.5 percent in those with the disease. In addition, the mortality rate in patients with coronary disease classified as severe was 62 percent, whereas it was 20 percent in those categorized as having moderate disease. The data indicate that patients with diabetes and end-stage renal disease who are at highest risk for cardiovascular events can be identified, and these patients probably should not undergo renal transplantation.",1,35,66,0.747292429709599,0.6251288056373596,167.36157730735195,0.6251288056373596,0.8801864385604858,0.7897327542304993,semantic_only_recovery,tar_augmented_et_gained
