topic_id,record_id,title,abstract,is_relevant,et_rank,st_rank,et_score,st_score,bm25_score,minilm_score,specter_score,medcpt_score,category,gain_type
CD011134,7226032,A statistical evaluation of baseline and follow-up carcinoembryonic antigen in patients with resectable colorectal carcinoma.,"A long-term CEA follow-up was evaluated statistically for a series of 74 patients with primary colorectal carcinoma who underwent resections for cure. Thirty-three recurrences and 29 deaths were reported among this population after a median follow-up interval of 55 months. Preoperative CEA levels correlated with the Dukes' classification. However, the preoperative level adds significant information to Dukes' classification in the prediction of recurrence. Postoperative CEA assays taken later in the clinical evaluation process carry the most prognostic information for subsequent recurrence. Using matched-pairs techniques, the authors noted that CEA often rose in anticipation of recurrence, sometimes as early as one year before recurrence. The following four follow-up CEA events were evaluated: 1) three consecutive rising CEA's 2) CEA rises 5.0 ng/ml; 3) CEA exceeds 5.0 ng/ml; 4) CEA exceeds 5.0 ng/ml two consecutive times. The follow-up CEA events examined were characterized by false positive rates ranging from 17% to 66% and true positive rates ranging from 43% to 56% in the prediction of recurrence. From follow-up CEA evaluations, further clinical investigation appeared most warranted when CEA exceeds 5.0 ng/ml at two consecutive follow-up evaluations, but the chances of finding any subsequent recurrent disease was near 50%. Among patients experiencing recurrences, although forewarned by CEA elevations, there was no subsequent time when patients were most likely to have recurrence of disease.",1,38,59,0.830811475516692,0.651753306388855,65.3250451699903,0.651753306388855,0.8043026328086853,0.8750485181808472,semantic_only_recovery,tar_augmented_et_gained
CD011134,7406353,Preoperative CEA level: a prognostic test in patients with colorectal carcinoma.,"Preoperative and postoperative carcinoembryonic antigen (CEA) levels were evaluated in 42 patients with colorectal carcinoma. Preoperative CEA values correlated inversely with survival at a statistically significant level and provided prognostic information not available by pathologic staging. Postoperative plasma CEA can accurately predict recurrent disease and may, when serial values are elevated, serve as an indication for a second-look procedure.",1,33,197,0.8401337641263487,0.6063015460968018,60.043496255907606,0.6063015460968018,0.8149794936180115,0.8764699101448059,semantic_only_recovery,tar_augmented_et_gained
CD011134,20162425,Lead time of carcinoembryonic antigen elevation in the postoperative follow-up of colorectal cancer did not affect the survival rate after recurrence.,"BACKGROUND AND AIMS: The role of carcinoembryonic antigen (CEA) in the early detection of recurrence during the postoperative follow-up of colorectal cancer remains unclear. We hypothesize that the tumor with longer lead time of CEA elevation to the definite recurrence may have a better prognosis because of its slower growth rate and closer observation. MATERIALS AND METHODS: From 1995 to 2003, 4,841 consecutive patients who received curative resection of localized colorectal adenocarcinoma were enrolled from a prospective database. The patients with persisting CEA elevation after operation had been already excluded. Postoperative follow-up, including physical examination, imaging, and CEA test, were performed according to a surveillance program. A CEA >/=5 ng/mL was defined as elevated. The definition of the CEA lead time was the period between CEA elevation and detection of recurrence. All statistical analyses were performed by SPSS package for Windows (Microsoft, Redmond, WA, USA). RESULTS: The postoperative median follow-up time for the 4,841 patients was 68 months. A total of 999 patients (20.6%) had CEA elevation and recurrence. Among these patients, recurrence was confirmed in 727 patients (72.8%)before, at the same time, or within 3 months of CEA elevation and thus had a short lead time of CEA elevation (SLT group). In 272 patients (27.2%), recurrence was confirmed after more than 3 months of CEA elevation and thus had a longer lead time of CEA elevation (LLT group). The recurrence pattern showed similarities in these two groups. A total of 193 patients (193/999, 19.3%) received a second radical operation, and 806 patients (80.7%) were inoperable. The re-resection rate between the SLT group (146 patients, 20.1%) and the LLT group (47 patients, 17.3%) was not significantly different. The overall survival rate after recurrence showed no difference between these two groups (P = 0.123). CONCLUSION: Most cases of recurrence were detected at nearly the same time when the CEA level was elevated. Therefore, a more sensitive test is needed for early detection. The relationship between the lead time of CEA and the clinical outcome was not statistically significant. A more aggressive approach to the patient who has CEA elevation and is highly suspect of recurrence may be needed.",1,34,127,0.8387366739255325,0.6234738826751709,168.85955248543576,0.6234738826751709,0.8208320736885071,0.8290097713470459,semantic_only_recovery,tar_augmented_et_gained
CD011134,1475624,"Serum carcinoembryonic antigen in relation to survival, DNA ploidy pattern, and recurrent disease in 406 colorectal carcinoma patients.","Serum carcinoembryonic antigen (CEA) levels in relation to survival, flow cytometric DNA ploidy pattern, Dukes stage, and recurrent disease was prospectively evaluated in 406 patients with colorectal carcinoma. In 246 patients (61%) the carcinomas were DNA aneuploid. Increased preoperative CEA levels (> 5 micrograms/l) were found in 151 of 363 evaluable patients (42%). Dukes stage-B patients with preoperative CEA elevation showed significantly poorer prognosis than those with normal CEA values (p = 0.001). A weak but significant correlation was found between preoperative CEA level and Dukes stage (Kendall's tau = 0.25, p < 0.01). Of 50 evaluable patients with clinical recurrence and postoperative normal or normalized CEA levels, 28 (56%) had a rise in CEA before or at the time of clinical recurrence. The sensitivity of the CEA test for primary and for recurrent disease was not significantly different in the DNA aneuploid and the DNA near-diploid groups.",1,18,56,0.8624165880132769,0.6530174016952515,251.06696595293252,0.6530174016952515,0.8138740658760071,0.8497965335845947,semantic_only_recovery,tar_augmented_et_gained
CD011134,7357243,The clinical significance of the pattern of elevated serum carcinoembryonic antigen (CEA) levels in recurrent colorectal cancer.,"Serial serum carcinoembryonic antigen (CEA) assays were performed in 148 patients after potentially curative surgery for colorectal cancer. Thirty-seven patients developed proved recurrent tumour in a follow-up period of 2-5 years. Elevated CEA levels were recorded in 36 of these patients and in 27 rising levels preceded clinical symptoms of recurrent tumour. Two distinct patterns of CEA rise were observed: a 'fast' rise in which serum concentrations reached 100 microgram/l within 6 months of the first elevation and a 'slow' rise in which concentrations remained less than 75 microgram/l for at least 12 months. The majority of patients with the 'fast' rise had metastatic spread, whereas most patients with a 'slow' rise had local recurrence alone. This differential pattern may help to predict the site of recurrent tumour.",1,5,98,0.9090580923146724,0.6338545680046082,97.2604605237671,0.6338545680046082,0.8347530364990234,0.872853696346283,semantic_only_recovery,tar_augmented_et_gained
CD011134,1431340,The role of serum carcinoembryonic antigen (CEA) in the management of patients with colorectal carcinoma: the experience of the Istituto Tumori of Milan.,"CEA determination has attained an important role in the clinical management of patients with tumors of the colorectal tract. In this paper the experience of the Istituto Tumori of Milan is reviewed and the results are discussed. Three hundred and thirty-six patients were followed after curative resection of colorectal carcinoma. The follow-up period was 15 years, from January 1975 to December 1990 (global follow-up 1358 years). In the course of follow-up 136 patients developed recurrent disease. The number of CEA determinations for each patient ranged from 1 to 37 (mean 8, total 3330). CEA levels of presurgical patients were related to the clinical stage. Among patients who developed recurrences 61% showed an increase in CEA serum levels. In 200 patients with a negative follow-up we observed only 15 cases of false-positive results.",1,39,131,0.8304930261207792,0.6232037544250488,58.94332828581564,0.6232037544250488,0.805119514465332,0.8683256506919861,semantic_only_recovery,tar_augmented_et_gained
CD011134,3470172,"Follow-up of colorectal cancer resected for cure. An experience with CEA, TPA, Ca 19-9 analysis and second-look surgery.","Sixty-four consecutive patients who had undergone curative resection for colorectal carcinoma were studied prospectively to evaluate the roles of sequential CEA determinations and independent instrumental follow-up in the early detection of resectable recurrences. Fifty-two of these patients also were submitted to sequential determinations of other tumor antigens: TPA (tissue polypeptide antigen) and Ca 19-9 (colon cancer antigen detected with a monoclonal antibody), for a retrospective evaluation of their utility as markers of recurrent tumors. Twenty-two recurrences were detected in a period ranging from 12 to 72 months (median, 47 months). CEA was the best predictor of recurrence (sensitivity, 90 percent) when compared with the other two markers (TPA sensitivity, 60 percent; Ca 19-9 sensitivity, 20 percent). When compared with the instrumental or biochemical examinations of the follow-up, CEA was still the most sensitive indicator of relapse although the specificity was quite low (78 percent) if minimal significative increases were considered. History and physical examination were more useful than CEA in detecting local recurrences in rectal cancer where the preoperative CEA level was low. A few second-look explorations based solely on small CEA increases failed to demonstrate recurrence or revealed peritoneal carcinomatosis. Selected second-look surgery based on demonstrated recurrences resulted in a resectability rate of 57 percent. A follow-up program based on frequent CEA assays, history, and physical examinations, including rectal, vaginal, and perineal exploration, is proposed. Extensive instrumental investigations should follow when a minimal significative CEA rise is observed, or when history and physical examinations suggest a possible recurrence. Second-look surgery should be evaluated after confirmed or highly suspected diagnosis of recurrence, on the basis of instrumental or clinical examinations.",1,29,90,0.8465414454715653,0.6370513439178467,294.6742999687659,0.6370513439178467,0.8107801079750061,0.8406525254249573,semantic_only_recovery,tar_augmented_et_gained
CD011134,8146525,Use of CA 19-9 in the early detection of recurrences in colorectal cancer: comparison with CEA.,The serum levels of CA 19-9 were determined in the follow-up of 370 patients with colorectal cancer and compared with CEA. An increase in CA 19-9 preceded clinical diagnosis of recurrence in 25% of 72 patients. The mean time between the rise in CA 19-9 and clinical diagnosis of relapse was 3.7 months (median 3). Sensitivity of CA 19-9 in the early diagnosis of recurrence was much lower than that obtained for CEA (75%). Only 1 patient had elevated CA 19-9 levels and normal CEA.,1,36,129,0.8344315219853266,0.6234294176101685,63.755296089786114,0.6234294176101685,0.7954161763191223,0.8573219776153564,semantic_only_recovery,tar_augmented_et_gained
CD011134,8137675,Value of carcinoembryonic antigen in the management of colorectal cancer.,"PURPOSE: The practical value of carcinoembryonic antigen (CEA) assay in the management of colorectal cancer after surgery is controversial. The value of CEA in the management of colorectal cancer was reviewed and discussed to justify the use of CEA assay in the management of colorectal cancer. METHODS: A retrospective study was performed on 318 patients who underwent resection by one surgeon (JYW) between 1981 and 1986 and who were followed for a minimum of 5 years or until death. RESULTS: The incidence of preoperative CEA levels > 5 ng/ml in Dukes Stages A, B, C, and D were 0, 32, 48, and 79 percent, respectively. Five-year survival rates for groups with CEA levels < or = 5 ng/ml and > 5 ng/ml were 85 percent and 55 percent (P < 0.05), respectively, in Dukes Stage B patients and 64 percent and 37 percent (P < 0.05) in Stage C patients. The sensitivity and specificity of postoperative CEA monitoring in detecting recurrent diseases were 66 percent and 94 percent, respectively, for patients with a preoperative CEA value < or = 5 ng/ml and 97 percent and 88 percent for patients with a higher preoperative CEA value. CONCLUSION: CEA is still the best tumor marker available to be used as an independent prognostic factor and as a monitor for recurrence of disease after primary tumor resection.",1,37,51,0.8320304680043831,0.6541438698768616,277.6847607749529,0.6541438698768616,0.8268525004386902,0.8647968769073486,semantic_only_recovery,tar_augmented_et_gained
CD011134,8080745,The role of CA-242 and CEA in surveillance following curative resection for colorectal cancer.,"This study was undertaken to evaluate the role of a new tumour marker, CA-242, alone or in combination with CEA in the practical management of colorectal cancer patients after potentially curative resection. A cohort of 149 patients who had undergone 'curative' surgery was followed up according to an intensive protocol in order to detect recurrent disease. Over a median tumour marker follow-up period of 24 months there were 25 recurrences in 24 patients. Both CEA and CA-242 alone detected half the local recurrences. The sensitivity of CEA was 84% for distant or mixed recurrence compared with 64% for CA-242. An abnormality of either CEA or CA-242 enabled detection of five out of six local recurrences and 17 out of 19 distant or mixed recurrences with a median lead time of 5 months for each marker. Both markers were elevated concurrently in only one local and 11 distant recurrences. While CA-242 alone is not superior to CEA, their combined use (either abnormal) has a high sensitivity (88%), specificity (78%) and negative predictive value (97%); this may be useful in reducing unnecessary investigations in follow-up programmes and as a guide to the initiation of further treatment for recurrent disease.",1,24,87,0.8550529729255683,0.6386203765869141,314.06850847809426,0.6386203765869141,0.7908836603164673,0.8648008108139038,semantic_only_recovery,tar_augmented_et_gained
CD011134,9176713,Evaluation of serum carcinoembryonic antigen monitoring in the follow-up of colorectal cancer patients with metastatic lymph nodes and a normal preoperative serum level.,"The value of serial serum carcinoembryonic antigen (CEA) assay in the follow-up of colorectal cancer patients with metastatic lymph nodes and normal (< or = 5 ng/ml) preoperative CEA levels, was examined in this study. Thirty-eight patients were studied and compared with 22 patients with elevated CEA levels. The overall sensitivity of CEA for the diagnosis of recurrence was 36%. Postoperative CEA was strongly influenced by the site of recurrence. CEA monitoring showed the best results in patients who developed hepatic metastases (sensitivity 60%, specificity 94%, positive predictive value 60%, and negative predictive value 94%), and was ineffective for the detection of locoregional or pulmonary metastases. The results indicate that elevation of CEA in the postoperative course of these patients is an indicator of the presence of hepatic metastases. Postoperative CEA monitoring should not be omitted in Dukes C patients with normal preoperative levels, and is more reliable for the detection of liver metastases.",1,15,184,0.8694431053568655,0.6090692281723022,253.2953415395598,0.6090692281723022,0.8465287685394287,0.8634536266326904,semantic_only_recovery,tar_augmented_et_gained
CD011134,6623661,Limitations of CEA monitoring as a guide to second-look surgery in colorectal cancer follow-up.,"Forty-two patients with localized colorectal cancer (Dukes' A, B, C stages) were treated with potentially curative surgery and controlled with a follow-up program, which included CEA monitoring, for a period ranging from 12 to 48 months (median 33 months). During this period, we observed recurrent neoplastic disease in 14 patients. A retrospective analysis of the results showed that: 1. patients with a preoperative CEA value greater than 20 ng/ml have a significantly higher risk of recurrence than the patients with CEA less than 20 ng/ml; 2. sensitivity of the CEA test was good for metastatic recurrent disease, fairly good for residual neoplastic disease, but insufficient for local recurrence; 3. test-specificity was poor, as demonstrated by the negative results of four exploratory laparotomies performed exclusively on the basis of increased CEA levels. Since the principal aim of a second-look operation is the cure of local recurrence, this type of surgery cannot be proposed only on the basis of increased CEA levels.",1,10,236,0.890548531906471,0.5981808304786682,67.92294673452821,0.5981808304786682,0.8545204401016235,0.8711826801300049,semantic_only_recovery,tar_augmented_et_gained
CD011134,10207736,Carcinoembryonic antigen: its value in the follow-up of patients with colorectal cancer.,"We examined the value of carcinoembryonic antigen (CEA) monitoring for detecting treatable recurrence of colorectal carcinoma. CEA assays were undertaken in 193 patients over a 2-year period. The levels in 34 patients were raised in one or more assays above the laboratory-defined upper limit of normal; 31 cases were reviewed retrospectively. In 10% of patients there were Dukes' A lesions at the initial resection, in 39% Dukes' B, and in 52% Dukes' C1 or C2. Tumours were rectal in 61%. Median follow-up was 3 years (range, 16 years-2 months). In 23 of 31 (74%) there were symptoms or signs of recurrent disease prior to or simultaneously with an observed rise in CEA; in 8 the CEA rise preceded the onset of symptoms or the appearance of signs. Of the 31 cases 26 underwent investigation for recurrent disease, but in only 6 of these was the investigation driven by the observed rise in CEA rather than the onset of symptoms or presence of signs. Three of these six were false-positive results (50%), one has been lost to follow-up, and two had confirmed recurrence. Neither of the two with recurrence had operable disease. One of the two had no further treatment, and one underwent laparotomy at which multiple peritoneal seedlings were found. In both of the two cases going to laparotomy, one of which was prompted by a high CEA, widely disseminated disease was found. Over a 2-year period, serial CEA measurement thus yielded no patient benefit.",1,27,88,0.8480600853681796,0.6371920108795166,315.99815115834497,0.6371920108795166,0.8297938108444214,0.8504981994628906,semantic_only_recovery,tar_augmented_et_gained
CD011134,697433,Use of CEA as an indicator of early recurrence and as a guide to a selected second-look procedure in patients with colorectal cancer.,"The usefulness of the CEA as an indicator of recurrence and a guide to selected second-look surgery was evaluated from a retrospective analysis of 358 patients with colorectal cancer and from a prospective experience with 16 patients all of whom had been admitted for second-look surgery because of postoperative elevations of CEA only. Our previous experience had shown that after curative resection the CEA usually returned to normal levels (less than 5 ng/ml) within one month, but became elevated at time of clinically obvious recurrence being very high in patients with liver metastases, but only moderately elevated or normal in patients with local recurrence. All 16 patients had previously had curative resection of colorectal cancer; 13 in the rectum or rectosigmoid and three in the right colon. There were 13 Dukes' C and three Dukes' B cancers. All had been followed clinically and by CEA testing at three monthly intervals and were considered free of disease (NED) at time of CEA elevation. The median disease free interval was 13 months (range 4-57 months) and the median CEA prompting admission for second-look operation was 21 ng/ml (range 10-56 ng/ml). The sites of recurrence were liver in six, lung in two and localized disease in six. Two patients had negative exploration for recurrence and were found to have cholelithiasis only (one of these later died of metastases). Resection for cure was done in seven and palliative resection or biopsy only was done in nine patients. At this time, four patients are NED (12-37 months), five are living with disease (10-16 months) and seven have died of disease (2-12 months). The CEA test provides a method of early detection of recurrence and may permit surgical retrieval in selected patients and earlier initiation of palliation in other patients. The longterm effects in patient salvage remain to be defined.",1,41,173,0.8250144815310011,0.6113790273666382,241.74310655835345,0.6113790273666382,0.8389841318130493,0.8512829542160034,semantic_only_recovery,tar_augmented_et_gained
CD011134,7148317,Clinical significance of carcinoembryonic antigen (CEA) in patients with adenocarcinoma in colon and rectum.,"Determination of carcinoembryonic antigen (CEA) in serum has been performed in 253 patients with proved adenocarcinoma in the colon and rectum. Preoperative CEA was normal in 58.3% of the patients. A correlation between CEA level and Dukes' grading was found. There was, however, no statistically significant difference in recurrence rate between patients with normal and patients with elevated pre-operative CEA. Transient CEA elevation was seen in the follow-up period after curative resection in 21.8%. 75% of the patients with recurrence had abnormal CEA, and CEA elevation was the first sign of recurrence in 59.1%. The majority of these patients, however, had advanced disease not available for surgical treatment. In cases with local resectable tumour CEA often was normal. Only a few patients had advantage of CEA determination for diagnosis of recurrence and its routine use is therefore questioned.",1,12,99,0.881293377791645,0.6337664127349854,75.4950623718487,0.6337664127349854,0.8105049133300781,0.8854761123657227,semantic_only_recovery,tar_augmented_et_gained
CD011134,17573747,A small rise in CEA is sensitive for recurrence after surgery for colorectal cancer.,"OBJECTIVE: Rise in carcinoembryonic antigen (CEA) above normal limits can indicate recurrent colorectal cancer. The aim of this study was to evaluate whether a small rise in CEA, even within normal limits was a sensitive indicator of recurrence. METHOD: 150 patients aged 22-87 years were followed up for a mean of 27 months after colorectal surgery with CEA 3 and 6 monthly computerized tomography. We analysed whether a rise in CEA > 1 ng/ml correlated with recurrence of metastases. RESULTS: Forty-six of 139 patients in final analysis had recurrent disease. A rise in CEA > 1 had a predictive value of 74% for recurrence or metastases (sensitivity 80%, specificity 86%). These findings were similar whether or not the CEA was normal preoperatively. CONCLUSION: If CEA is measured after surgery for colorectal cancer, a rise of >1 in the patient's postoperative value is predictive for recurrence or metastases with an overall sensitivity of 80% and specificity of 86%. Previous studies have recognized the role of large rises in CEA in predicting recurrence but this study shows that small changes in CEA may be significant even if these levels would be traditionally within 'normal' limits.",1,13,296,0.8796929920662825,0.5861605405807495,277.8425233905381,0.5861605405807495,0.8296802043914795,0.8759438395500183,semantic_only_recovery,tar_augmented_et_gained
CD011548,3310222,[Sonographic diagnosis of bile duct calculi. Results of a prospective study of 222 cases of choledocholithiasis].,"To evaluate sonographic accuracy in the diagnosis of choledochal calculi 490 patients with cholestasis were examined prospectively with real-time scanner before ERCP or surgery. Ultrasound detected duct stones in 177 of 222 patients (sensibility 80%) and their absence in 242 of 268 (specificity 90%). Dilated extrahepatic bile ducts were demonstrated via ultrasound in 84% of cases with choledocholithiasis, dilated intrahepatic bile ducts in 57%. Intestinal gas obscuring the distal common duct was the most important factor limiting the ability of ultrasound to detect duct stones.",1,40,205,0.8114884899924603,0.6280542612075806,63.51817487555776,0.6280542612075806,0.8545678853988647,0.8345199227333069,semantic_only_recovery,tar_augmented_et_gained
