record_id,title,abstract,screening_label,is_relevant,et_rank,hybrid_rank,tar_rank,et_score,hybrid_score,tar_score,category,gain_type
#132,GENOMICON-Seq enables realistic simulation of amplicon and exome sequencing for low-frequency mutation detection.,"Accurate detection of low-frequency mutations is crucial for understanding viral evolution and tumorigenesis in humans, but is often confounded by technical artifacts introduced during library preparation and sequencing. We present GENOMICON-Seq, an end-to-end simulation tool that models both amplicon and whole exome sequencing (WES) workflows with realistic biological mutations and technical noise. GENOMICON-Seq inserts ground truth mutations, ranging from APOBEC3-like edits to COSMIC single base substitution signatures, before subjecting samples to simulated PCR errors, probe-capture enrichment, and Illumina-specific sequencing biases. By tracking each mutation's origin (true or error-derived), researchers can pinpoint detection limits and optimize variant-calling thresholds. We illustrate GENOMICON-Seq's versatility through study cases involving human papillomavirus (HPV) amplicon sequencing, highlighting the impacts of polymerase fidelity, viral copy number, and read depth on detecting low-frequency mutations. In parallel, WES simulations demonstrate how capture biases and varying allele frequencies affect somatic mutation calls. GENOMICON-Seq is thus a flexible, reproducible framework for assessing new protocols, benchmarking variant callers, and refining data analysis pipelines, ultimately reducing costly trial-and-error in the laboratory. The Docker-based package is freely available at https://github.com/Rounge-lab/GENOMICON-Seq .",include,1,250,376,75,0.5429666894858121,0.6738729487483561,0.6567375736493755,false_negative_beyond_rank245,et_false_negative_after_rank90
#1470,Detecting somatic mutations in single-cell data sets,"We present an algorithm, SComatic, that can be used to directly detect somatic mutations in single-cell data sets without using a reference sample. This method opens the possibility of studying clonal relationships among cells, mutational processes at single-cell resolution, and the impact of somatic mutations on cell function in development and disease.",include,1,252,258,159,0.5415233111013921,0.7063371007317328,0.5169780265599182,false_negative_beyond_rank245,et_false_negative_after_rank90
#142,Whole-Exome Sequencing Reveals Novel Candidate Driver Mutations and Potential Druggable Mutations in Patients with High-Risk Neuroblastoma.,"Neuroblastoma is the most prevalent solid tumor in early childhood, with a 5-year overall survival rate of 40-60% in high-risk cases. Therefore, the identification of novel biomarkers for the diagnosis, prognosis, and therapy of neuroblastoma is crucial for improving the clinical outcomes of these patients. In this study, we conducted the whole-exome sequencing of 48 freshly frozen tumor samples obtained from the Biobank. Somatic variants were identified and selected using a bioinformatics analysis pipeline. The mutational signatures were determined using the Mutalisk online tool. Cancer driver genes and druggable mutations were predicted using the Cancer Genome Interpreter. The most common mutational signature was single base substitution 5. MUC4, MUC16, and FLG were identified as the most frequently mutated genes. Using the Cancer Genome Interpreter, we identified five recurrent cancer driver mutations spanning MUC16, MUC4, ALK, and CTNND1, with the latter being novel and containing a missense mutation, R439C. We also identified 11 putative actionable mutations including NF1 Q1798*, Q2616*, and S636X, ALK F1174L and R1275Q, SETD2 P10L and Q1829E, BRCA1 R612S, NOTCH1 D1670V, ATR S1372L, and FGFR1 N577K. Our findings provide a comprehensive overview of the novel information relevant to the underlying molecular pathogenesis and therapeutic targets of neuroblastoma.",include,1,254,326,508,0.5393077885143669,0.6848052396070733,0.2467479345569622,false_negative_beyond_rank245,et_false_negative_after_rank90
#378,MOV&RSim: computational modelling of cancer-specific variants and sequencing reads characteristics for realistic tumoral sample simulation.,"BACKGROUND: Bioinformatics pipelines for variant calling have undergone significant advancements due to the decreasing costs of next-generation sequencing. Accurate mutation detection is crucial for personalised medicine in cancer, particularly in assignment of therapy. Somatic variant calling, however, remains challenging due to diverse cancer types, heterogeneity, complex mutational profiles, and unpredictable sequencing errors. A dataset of fully characterised tumoral genomes and sequencing reads, large enough to represent the variability inherent in different cancer types, is still lacking, even considering synthetic data. The lack of such datasets hampers rigorous evaluation, benchmarking and optimization of variant callers for specific cancer types. RESULTS: The contribution of this work is twofold. First, we conducted a comprehensive analysis of nine somatic sample simulators (Synggen, BAMSurgeon, SVEngine, VarSim, Xome-Blender, tHapMix, Pysim-sv, SCNVSim, HeteroGenesis) assessing their ability to control biological parameters, including variants characteristics (type, number, position, length, content, zygosity), and sample characteristics (clonality, contamination); and technical parameters, including reads characteristics (sequencing errors, coverage, base qualities). No single simulator provided complete control over both biological and technical parameters, nor guidance on tuning biological parameters for cancer-specific simulations. Consequently, we developed MOV&RSim, a novel simulator that leverages data-driven information to set variants and reads characteristics, producing realistic tumoral samples, and providing full control on biological and technical parameters. Additionally, we leveraged well-annotated variant databases to create cancer-specific presets that inform the simulator’s parameters for 21 cancer types. CONCLUSION: This new simulator, containerised with Docker and freely available for academic use, empowers users to define each biological parameter of a tumoral genome and faithfully replicates the variability of technical noise observed in real sequencing reads. The proposed simulator and presets represent the most adaptable and comprehensive framework currently available for generating tumor samples, enabling comprehensive benchmarking and, ultimately, the optimization of somatic variant callers across diverse cancer types.",include,1,271,598,40,0.5132151909587742,0.6301560682400119,0.7560089967051605,false_negative_beyond_rank245,et_false_negative_after_rank90
#487,A comparative analysis of mutational profiles between triple-negative breast cancer and non-triple-negative breast cancer.,"OBJECTIVE: Among breast cancer subtypes, triple-negative breast cancer (TNBC) is associated with the poorest prognosis and currently lacks effective targeted therapies. While gene mutation profiling provides valuable insights into recurrent mutations and genomic heterogeneity, the comparative mutational characteristics distinguishing TNBC from non-TNBC tumors have not been comprehensively investigated. This study aims to elucidate these differences through a systematic comparative analysis. METHODS: We retrieved clinical data and somatic mutation profiles of 704 breast cancer patients from The Cancer Genome Atlas (TCGA) database. Based on hormone receptor expression status, the breast cancer samples were stratified into TNBC cohort (n = 109) and non-TNBC cohort (n = 595). Comprehensive genomic analysis was performed to compare differences in mutational profiles between the two cohorts, including differential frequencies of recurrent mutations, interaction patterns of co-occurring and mutually exclusive mutations, driver genes, decomposition of mutational signatures using the Catalogue of Somatic Mutations in Cancer (COSMIC) database, and pathway enrichment of significantly altered genes. RESULTS: Compared to the non-TNBC cohort, the TNBC patients had a younger age at onset. Significant differences were observed in the mutation rate of TP53 (81% vs. 27%, p < 2.2 × 10(- 16)), PIK3CA (11% vs. 38%, p = 5.4 × 10(- 9)) and GATA3 (1% vs. 16%, p = 1.0 × 10(- 6)) between TNBC and non-TNBC cohorts. TNBC also exhibited a higher tumor mutation burden (TMB) than non-TNBC (1.2 vs. 0.6 mutations/Mb). Genes in TNBC predominantly exhibited a co-mutation pattern, whereas non-TNBC showed either co-occurring or mutually exclusive mutational relationships. TTN and PIK3CA were identified as key driver genes in TNBC, while non-TNBC exhibited greater diversity in driver alterations, including MAP3K1 and KMT2C. Mutational signature analysis revealed that Single-Base Substitution2 (SBS2) and SBS6 were common to both cohorts, while SBS3 and SBS26 were predominantly enriched in TNBC, and SBS10b was more frequent in non-TNBC. Pathway enrichment analysis showed that the most affected oncogenic pathways in TNBC were TP53, TGF-Beta, RTK-RAS, and Hippo pathways, whereas non-TNBC involved TP53, TGF-Beta, NRF2, PI3K, and RTK-RAS pathways. CONCLUSIONS: Our study delineates the distinct genomic mutational landscapes between TNBC and non-TNBC cohorts, and reveals somatic interactions, driver genes, mutational signatures and pathway enrichment. These findings highlight the distinct molecular features of TNBC, which may contribute to its aggressive clinical behavior.",include,1,278,199,599,0.4963037779060443,0.7237306434743775,0.2176386062152449,false_negative_beyond_rank245,et_false_negative_after_rank90
#1143,Origins and characterization of variants shared between databases of somatic and germline human mutations.,"BACKGROUND: Mutations arise in the human genome in two major settings: the germline and the soma. These settings involve different inheritance patterns, time scales, chromatin structures, and environmental exposures, all of which impact the resulting distribution of substitutions. Nonetheless, many of the same single nucleotide variants (SNVs) are shared between germline and somatic mutation databases, such as between the gnomAD database of 120,000 germline exomes and the TCGA database of 10,000 somatic exomes. Here, we sought to explain this overlap. RESULTS: After strict filtering to exclude common germline polymorphisms and sites with poor coverage or mappability, we found 336,987 variants shared between the somatic and germline databases. A uniform statistical model explains 34% of these shared variants; a model that incorporates the varying mutation rates of the basic mutation types explains another 50% of shared variants; and a model that includes extended nucleotide contexts (e.g. surrounding 3 bases on either side) explains an additional 4% of shared variants. Analysis of read depth finds mixed evidence that up to 4% of the shared variants may represent germline variants leaked into somatic call sets. 9% of the shared variants are not explained by any model. Sequencing errors and convergent evolution did not account for these. We surveyed other factors as well: Cancers driven by endogenous mutational processes share a greater fraction of variants with the germline, and recently derived germline variants were more likely to be somatically shared than were ancient germline ones. CONCLUSIONS: Overall, we find that shared variants largely represent bona fide biological occurrences of the same variant in the germline and somatic setting and arise primarily because DNA has some of the same basic chemical vulnerabilities in either setting. Moreover, we find mixed evidence that somatic call-sets leak appreciable numbers of germline variants, which is relevant to genomic privacy regulations. In future studies, the similar chemical vulnerability of DNA between the somatic and germline settings might be used to help identify disease-related genes by guiding the development of background-mutation models that are informed by both somatic and germline patterns of variation.",include,1,307,277,307,0.4456881001546201,0.7005114736520333,0.3545258768147588,false_negative_beyond_rank245,et_false_negative_after_rank90
#3465,The somatic mutation landscape of normal gastric epithelium,"The landscapes of somatic mutation in normal cells inform us about the processes of mutation and selection operative throughout life, providing insight into normal ageing and the earliest stages of cancer development1. Here, by whole-genome sequencing of 238 microdissections2 from 30 individuals, including 18 with gastric cancer, we elucidate the developmental trajectories of normal and malignant gastric epithelium. We find that gastric glands are units of monoclonal cell populations that accrue roughly 28 somatic single-nucleotide variants per year, predominantly attributable to endogenous mutational processes. In individuals with gastric cancer, metaplastic glands often show elevated mutation burdens due to acceleration of mutational processes linked to proliferation and oxidative damage. Unusually for normal cells, gastric epithelial cells often carry recurrent trisomies of specific chromosomes, which are highly enriched in a subset of individuals. Surveying 829 polyclonal gastric microbiopsies by targeted sequencing, we find somatic ‘driver’ mutations in a distinctive repertoire of known cancer genes, including ARID1A, ARID1B, ARID2, CTNNB1 and KDM6A. The prevalence of mutant clones increases with age to occupy roughly 8% of the gastric epithelial lining by age 60 years and is significantly increased by the presence of severe chronic inflammation. Our findings provide insights into intrinsic and extrinsic influences on somatic evolution in the gastric epithelium in healthy, precancerous and malignant states. © The Author(s) 2025.",include,1,311,269,632,0.4405526891941591,0.7027182486307163,0.212126457365251,false_negative_beyond_rank245,et_false_negative_after_rank90
#292,Reconstructing phylogenetic trees from genome-wide somatic mutations in clonal samples.,"Phylogenetic trees are a powerful means to display the evolutionary history of species, pathogens and, more recently, individual cells of the human body. Whole-genome sequencing of laser capture microdissections or expanded stem cells has allowed the discovery of somatic mutations in clones, which can be used as natural barcodes to reconstruct the developmental history of individual cells. Here we describe Sequoia, our pipeline to reconstruct lineage trees from clones of normal cells. Candidate somatic mutations are called against the human reference genome and filtered to exclude germline mutations and artifactual variants. These filtered somatic mutations form the basis for phylogeny reconstruction using a maximum parsimony framework. Lastly, we use a maximum likelihood framework to explicitly map mutations to branches in the phylogenetic tree. The resulting phylogenies can then serve as a basis for many subsequent analyses, including investigating embryonic development, tissue dynamics in health and disease, and mutational signatures. Sequoia can be readily applied to any clonal somatic mutation dataset, including single-cell DNA sequencing datasets, using the commands and scripts provided. Moreover, Sequoia is highly flexible and can be easily customized. Typically, the runtime of the core script ranges from minutes to an hour for datasets with a moderate number (50,000-150,000) of variants. Competent bioinformatic skills, including in-depth knowledge of the R programming language, are required. A high-performance computing cluster (one that is capable of running mutation-calling algorithms and other aspects of the analysis at scale) is also required, especially if handling large datasets.",include,1,318,382,147,0.4248351635595347,0.6718773307074907,0.5375171945772633,false_negative_beyond_rank245,et_false_negative_after_rank90
#418,Discovering cryptic splice mutations in cancers via a deep neural network framework.,"Somatic mutations can disrupt splicing regulatory elements and have dramatic effects on cancer genes, yet the functional consequences of mutations located in extended splice regions is difficult to predict. Here, we use a deep neural network (SpliceAI) to characterize the landscape of splice-altering mutations in cancer. In our in-house series of 401 liver cancers, SpliceAI uncovers 1244 cryptic splice mutations, located outside essential splice sites, that validate at a high rate (66%) in matched RNA-seq data. We then extend the analysis to a large pan-cancer cohort of 17 714 tumors, revealing >100 000 cryptic splice mutations. Taking into account these mutations increases the power of driver gene discovery, revealing 126 new candidate driver genes. It also reveals new driver mutations in known cancer genes, doubling the frequency of splice alterations in tumor suppressor genes. Mutational signature analysis suggests mutational processes that could give rise preferentially to splice mutations in each cancer type, with an enrichment of signatures related to clock-like processes and DNA repair deficiency. Altogether, this work sheds light on the causes and impact of cryptic splice mutations in cancer, and highlights the power of deep learning approaches to better annotate the functional consequences of mutations in oncology.",include,1,374,485,203,0.3334327580964376,0.6470796003412302,0.4454719684963976,false_negative_beyond_rank245,et_false_negative_after_rank90
#3449,Whole-Exome Analysis to Decipher the Mutational Profiles of Patients with Triple-Negative Breast Cancer (TNBC),"The subsequent development and optimization of next-generation sequencing (NGS) technologies and computational tools was a contributing factor to advances in genome-wide analyses, such as whole-exome sequencing (WES). WES represents an efficient and cost-effective strategy for dismembering the genetic basis and traits of diseases. This approach has proven effective, as it has achieved results that were unattainable through traditional gene discovery strategies. The purpose of this study was to identify pathogenic genetic variants in triple-negative breast cancer TNBC patients via WES. We performed bioinformatics analysis to detect single nucleotide polymorphisms (SNPs) and indels in WES DNA sequences from 4 TNBC samples that are publicly available. The raw reads were aligned to the GRCh38 human reference genome via the Burrows–Wheeler Aligner. BAM files were sorted, and duplicates were marked via SAM tools and Sambamba. Variants were called with Strelka and annotated via the Variant Effect Predictor (VEP). Population frequencies were added from the gnomAD exome and genome databases. ClinVar, SIFT, and PolyPhen were used to assess clinical significance and impact. A total of 21,053 variants were identified: 82.7% SNVs, 6.8% deletions, 4.9% insertions, and 5.6% sequence alterations. Most of the variants had a low impact (58.1%), whereas the other variants had moderate and high impacts (41.9%). Significant deleterious variants were found in the TP53, NF1, and BRCA1/BRCA2 genes. These findings enhance the molecular understanding of TNBC and highlight candidate genes for further investigation. Functional validation is still needed to elucidate their roles in tumor development and therapeutic potential. © The Author(s), under exclusive license to Springer Nature Switzerland AG 2025.",include,1,410,474,624,0.2748887583958251,0.6502008644398231,0.2132920839535679,false_negative_beyond_rank245,et_false_negative_after_rank90
#483,Scalable and comprehensive mosaic variant calling using DRAGEN.,"Detecting low variant allele fraction (VAF) mosaic variants without matching controls remains a major challenge in genomics, limited by technical noise, lack of benchmarks, and computational scalability. We present the DRAGEN mosaic caller, a hardware-accelerated approach identifying variants down to ~1-2% VAF with low false-positive rates and hour-scale runtimes for mosaic SNV/indel detection from bulk sequencing. To support evaluation, we introduce a genome-wide low-VAF benchmark for variants between 1-10% VAF. Application to blood, sperm, and brain tissues revealed patterns, including mosaic hotspots and mutational signatures. The first analysis of HG002 blood showed that many ""mosaic"" variants defined from HG002 cell lines are likely culture-derived and not in vivo mutations. Importantly, DRAGEN also enables personalized assembly pangenome references to improve alignment and mosaic variant detection in complex regions. Together, this development makes routine low-VAF discovery feasible, opening new opportunities to study mosaic mutations in healthy and disease individuals.",include,1,434,507,282,0.2423575150846738,0.6432998627509214,0.3728205064656494,false_negative_beyond_rank245,et_false_negative_after_rank90
#1577,LRT-CLUSTER: A New Clustering Algorithm Based on Likelihood Ratio Test to Identify Driving Genes,"Somatic mutations often occur at high relapse sites in protein sequences, which indicates that the location clustering of somatic missense mutations can be used to identify driving genes. However, the traditional clustering algorithm has such problems as the background signal over-fitting, the clustering algorithm is not suitable for mutation data, and the performance of identifying low-frequency mutation genes needs to be improved. In this paper, we propose a linear clustering algorithm based on likelihood ratio test knowledge to identify driver genes. In this experiment, firstly, the polynucleotide mutation rate is calculated based on the prior knowledge of likelihood ratio test. Then, the simulation data set is obtained through the background mutation rate model. Finally, the unsupervised peak clustering algorithm is used to, respectively, evaluate the somatic mutation data and the simulation data to identify the driver genes. The experimental results show that our method achieves a better balance of precision and sensitivity. It can also identify the driver genes missed by other methods, making it an effective supplement to other methods. We also discover some potential linkages between genes and between genes and mutation sites, which is of great value to target drug therapy research.[GRAPHICS]",include,1,437,626,207,0.2417373147177791,0.623919894417534,0.4399210262540539,false_negative_beyond_rank245,et_false_negative_after_rank90
