Title,Authors,Abstract,Published Year,Published Month,Journal,Volume,Issue,Pages,Accession Number,DOI,Ref,Covidence #,Study,Notes,Tags
Improved Mutation Detection in Duplex Sequencing Data with Sample-Specific Error Profiles.,Cheng Y; Nandi SP; Culibrk L; Kristin A; Stuewe I; Al-Azzam S; Petljak M; Alexandrov LB,"Duplex sequencing enables highly accurate detection of rare somatic mutations, but existing variant callers often rely on protocol-specific heuristics that limit sensitivity, reproducibility, and cross-study comparability. We present DupCaller, a probabilistic variant caller that builds sample-specific error profiles and applies a strand-aware statistical model for mutation detection. Across 50 synthetic datasets, DupCaller identified 1.25-fold more single-base substitutions (SBSs) and 1.41-fold more indels than a state-of-the-art method, while exhibiting equal or better precision. In three duplex-sequenced cell lines treated with aristolochic acid, it recovered expected mutational signatures while detecting 3.5-fold more SBSs and 2.8-fold more indels. In 93 tissue samples-including neurons, cord blood, sperm, saliva, and blood-DupCaller showed consistent gains, detecting 1.21- to 2.7-fold more mutations. Sensitivity scaled with sample duplication rate, yielding approximately 1.5-fold more mutations under optimal conditions and over 3-fold more in low-duplication samples where other tools falter. These results establish DupCaller as a robust and scalable solution for somatic mutation profiling in duplex sequencing across diverse biological and technical contexts.",2025,Jul,bioRxiv,,,,,10.1101/2025.07.13.664565,40791398,#1033,Cheng 2025,"",""
SNMF: Integrated Learning of Mutational Signatures and Prediction of DNA Repair Deficiencies.,Goossens S; Tepeli YI; Seale C; Gonçalves JP,"MOTIVATION: Many tumours show deficiencies in DNA damage response (DDR), which influence tumorigenesis and progression, but also expose vulnerabilities with therapeutic potential. Assessing which patients might benefit from DDR-targeting therapy requires knowledge of tumour DDR deficiency status, with mutational signatures reportedly better predictors than loss of function mutations in select genes. However, signatures are identified independently using unsupervised learning, and therefore not optimised to distinguish between different pathway or gene deficiencies. RESULTS: We propose SNMF, a supervised non-negative matrix factorisation that jointly optimises the learning of signatures: (1) shared across samples, and (2) predictive of DDR deficiency. We applied SNMF to mutation profiles of human induced pluripotent cell lines carrying gene knockouts linked to three DDR pathways. The SNMF model achieved high accuracy (0.971) and learned more complete signatures of the DDR status of a sample, further discerning distinct mechanisms within a pathway. Cell line SNMF signatures recapitulated tumour-derived COSMIC signatures and predicted DDR pathway deficiency of TCGA tumours with high recall, suggesting that SNMF-like models can leverage libraries of induced DDR deficiencies to decipher intricate DDR signatures underlying patient tumours. AVAILABILITY: https://github.com/joanagoncalveslab/SNMF .",2024,Nov,bioRxiv,,,,,10.1101/2024.11.27.624656,39651280,#1039,Goossens 2024,"",""
Detecting Somatic Mutations Without Matched Normal Samples Using Long Reads.,Simpson JT,"DNA sequencing of tumours to identify somatic mutations has become a critical tool to guide the type of treatment given to cancer patients. The gold standard for mutation calling is comparing sequencing data from the tumour to a matched normal sample to avoid mis-classifying inherited SNPs as mutations. This procedure works extremely well, but in certain situations only a tumour sample is available. While approaches have been developed to find mutations without a matched normal, they have limited accuracy or require specific types of input data (e.g. ultra-deep sequencing). Here we explore the application of single molecule long read sequencing to calling somatic mutations without matched normal samples. We develop a simple theoretical framework to show how haplotype phasing is an important source of information for determining whether a variant is a somatic mutation. We then use simulations to assess the range of experimental parameters (tumour purity, sequencing depth) where this approach is effective. These ideas are developed into a prototype somatic mutation caller, smrest, and its use is demonstrated on two highly mutated cancer cell lines. Finally, we argue that this approach has potential to measure clinically important biomarkers that are based on the genome-wide distribution of mutations: tumour mutation burden and mutation signatures.",2024,Feb,bioRxiv,,,,,10.1101/2024.02.26.582089,38464143,#1057,Simpson 2024,"",""
Evaluating Multiple Next-Generation Sequencing-Derived Tumor Features to Accurately Predict DNA Mismatch Repair Status.,Walker R; Georgeson P; Mahmood K; Joo JE; Makalic E; Clendenning M; Como J; Preston S; Joseland S; Pope BJ; Hutchinson RA; Kasem K; Walsh MD; Macrae FA; Win AK; Hopper JL; Mouradov D; Gibbs P; Sieber OM; O'Sullivan DE; Brenner DR; Gallinger S; Jenkins MA; Rosty C; Winship IM; Buchanan DD,"Identifying tumor DNA mismatch repair deficiency (dMMR) is important for precision medicine. Tumor features, individually and in combination, derived from whole-exome sequenced (WES) colorectal cancers (CRCs) and panel-sequenced CRCs, endometrial cancers (ECs), and sebaceous skin tumors (SSTs) were assessed for their accuracy in detecting dMMR. CRCs (n = 300) with WES, where mismatch repair status was determined by immunohistochemistry, were assessed for microsatellite instability (MSMuTect, MANTIS, MSIseq, and MSISensor), Catalogue of Somatic Mutations in Cancer tumor mutational signatures, and somatic mutation counts. A 10-fold cross-validation approach (100 repeats) evaluated the dMMR prediction accuracy for i) individual features, ii) Lasso statistical model, and iii) an additive feature combination approach. Panel-sequenced tumors (29 CRCs, 22 ECs, and 20 SSTs) were assessed for the top performing dMMR predicting features/models using these three approaches. For WES CRCs, 10 features provided >80% dMMR prediction accuracy, with MSMuTect, MSIseq, and MANTIS achieving ≥99% accuracy. The Lasso model achieved 98.3% accuracy. The additive feature approach, with three or more of six of MSMuTect, MANTIS, MSIseq, MSISensor, insertion-deletion count, or tumor mutational signature small insertion/deletion 2 + small insertion/deletion 7 achieved 99.7% accuracy. For the panel-sequenced tumors, the additive feature combination approach of three or more of six achieved accuracies of 100%, 95.5%, and 100% for CRCs, ECs, and SSTs, respectively. The microsatellite instability calling tools performed well in WES CRCs; however, an approach combining tumor features may improve dMMR prediction in both WES and panel-sequenced data across tissue types.",2023,Feb,J Mol Diagn,25,2,94-109,,10.1016/j.jmoldx.2022.10.003,36396080,#1087,Walker 2023,"",""
The role of genomics in global cancer prevention.,Ginsburg O; Ashton-Prolla P; Cantor A; Mariosa D; Brennan P,"Despite improvements in the understanding of cancer causation, much remains unknown regarding the mechanisms by which genomic and non-genomic factors initiate carcinogenesis, drive cell invasion and metastasis, and enable cancer to develop. Technological advances have enabled the analysis of whole genomes, comprising thousands of tumours across populations worldwide, with the aim of identifying mutation signatures associated with particular tumour types. Large collaborative efforts have resulted in the identification and improved understanding of causal factors, and have shed light on new opportunities to prevent cancer. In this new era in cancer genomics, discoveries from studies conducted on an international scale can inform evidence-based strategies in cancer control along the cancer care continuum, from prevention to treatment. In this Review, we present the relevant history and emerging frontiers of cancer genetics and genomics from the perspective of global cancer prevention. We highlight the importance of local context in the adoption of new technologies and emergent evidence, with illustrative examples from worldwide. We emphasize the challenges in implementing important genomic findings in clinical settings with disparate resource availability and present a conceptual framework for the translation of such findings into clinical practice, and evidence-based policies in order to maximize the utility for a population.",2021,Feb,Nat Rev Clin Oncol,18,2,116-128,,10.1038/s41571-020-0428-5,32973296,#1139,Ginsburg 2021,"",""
Pathway Mutations in Breast Cancer Using Whole-Exome Sequencing.,Chang YS; Chang CM; Lin CY; Chao DS; Huang HY; Chang JG,"The genomic landscape of breast cancer (BC) is complex. The purpose of this study was to decipher the mutational profiles of Taiwanese patients with BC using next-generation sequencing. We performed whole-exome sequencing on DNA from 24 tumor tissue specimens from BC patients. Sanger sequencing was used to validate the identified variants. Sanger sequencing was also performed on paired adjacent nontumor tissues. After genotype calling and algorithmic annotations, we identified 49 deleterious variants in canonical cancer-related genes in our BC cohort. The most frequently mutated genes were PIK3CA (16.67%), FKBP9 (12.5%), TP53 (12.5%), ATM (8.33%), CHEK2 (8.33%), FOXO3 (8.33%), NTRK1 (8.33%), and NUTM2B (8.33%). Seven mutated variants (ATR p.V1581fs, CSF1R p.R579Q, GATA3 p.T356delinsTMKS, LRP5 p.W389*, MAP3K1 p.T918fs, MET p.K1161fs, and MTR p.P1178S) were novel variants that are not present in any gene mutation database. After grouping the samples according to molecular subtype, we found that the cell cycle, MAPK, and chemokine signaling pathways in the luminal A subtype of BC; the focal adhesion, axon guidance, and endocytosis pathways in the luminal B subtype; and amyotrophic lateral sclerosis in the basal-like subtype were exclusively altered. Survival curve analysis showed that the presence of the MAPK signaling pathway and endocytosis mutations were correlated with a poor prognosis. These survival data were consistent with cBioPortal analyses of 2,051 BC cases. We discovered novel mutations in patients with BC. These results have implications for developing strategic, adjuvant, and gene-targeted therapies.",2020,Mar,Oncol Res,28,2,107-116,,10.3727/096504019X15698362825407,31575382,#1150,Chang 2020,"",""
Genomic landscape and subgroup stratification of thymic epithelial tumors: a systematic meta-analysis of next-generation sequencing data.,Pardini E; Barachini S; Montali M; Burzi IS; Sardo Infirri G; Tagliafierro D; Petrini I,"INTRODUCTION: Thymic epithelial tumors are rare cancers of the anterior mediastinum with heterogeneous clinical behaviors. Despite numerous attempts to characterize their mutational landscape, a comprehensive understanding of their genetic alterations remains limited due to small sample sizes. METHODS: To address this gap, we conducted a systematic meta-analysis of somatic mutations reported in 729 patients across twenty studies, integrating single-variant data into a unified dataset. RESULTS: This approach identified three molecular subgroups with distinct biological and clinical features. Tumors harboring GTF2I mutations were typically indolent, exhibited low mutational burden, and showed enrichment in pathways related to cell adhesion. Tumors with TP53 mutations displayed high mutational load, activation of receptor tyrosine kinase and mitogenic signaling, and corresponded to aggressive clinical behavior. Tumors lacking both GTF2I and TP53 mutations revealed intermediate pro les, characterized by alterations in epigenetic regulation and extracellular matrix organization. Mutational signature analysis indicated that age-related processes predominate in less aggressive tumors, while DNA repair de ciency characterizes those with TP53 mutations. Network and pathway analyses revealed convergent oncogenic hubs and distinct signaling dependencies across subgroups. DISCUSSION: This large-scale integrative study provides a re ned map of the genetic landscape of thymic epithelial tumors, highlights biologically meaningful heterogeneity, and establishes a framework to guide future research and the development of targeted therapies.",2026,,Front Oncol,16,,1781510,,10.3389/fonc.2026.1781510,41836256,#1156,Pardini 2026,"",""
Mutational signature-based biomarker to predict the response of immune checkpoint inhibitors therapy in cancers.,Huang YE; Zhou S; Chen S; Chen J; Zhou X; Hou F; Liu H; Yuan M; Jiang W,"Patients have a limited response rate to immune checkpoint inhibitors (ICIs) therapy. Although several biomarkers have been proposed, their ability to accurately predict the response to ICIs therapy remains unsatisfactory. In addition, mutational signatures were validated to be associated with ICIs therapy. Therefore, we developed a mutational signature-based biomarker (MS-bio) to predict the response to ICIs therapy. Based on differentially mutated genes, we extracted six mutational signatures (single-base substitution (SBS)-A, SBS-B, SBS-C, SBS-D, double-base substitution (DBS)-A, and DBS-B) as MS-bio, and constructed a random forest (RF) model to predict the response. Internal and external validations consistently demonstrated the excellent predictive capability of MS-bio, with an accuracy reaching up to 0.82. Moreover, MS-bio exhibited superior performance compared to existing biomarkers. To further validate the accuracy of MS-bio, we explored its performance in The Cancer Genome Atlas (TCGA) cohort and found that the predicted responders were immunologically ""hot"". Finally, we found that SBS-C had the highest importance in prediction and was related to T cell differentiation. Overall, here we introduced MS-bio as a novel biomarker for accurately predicting the response to ICIs therapy, thereby contributing to the advancement of precision medicine.",2025,May,Int J Biol Macromol,308,Pt 4,142585,,10.1016/j.ijbiomac.2025.142585,40154701,#1176,Huang 2025,"",""
Designing Evolutionary-based Interception Strategies to Block the Transition from Precursor Phases to Multiple Myeloma.,Maura F; Landgren O; Morgan GJ,"The development of next-generation sequencing technology has dramatically improved our understanding of the genetic landscape of multiple myeloma. Several new drivers and recurrent events have been reported and linked to a potential driver role. This complex landscape is enhanced by intraclonal mutational heterogeneity and variability introduced through the dimensions of time and space. The evolutionary history of multiple myeloma is driven by both the accumulation of different genomic drivers and by the activity of different mutational processes active overtime. In this review, we describe how these new findings and sequencing technologies have been progressively allowed to understand and reshape our knowledge of the complexity of multiple myeloma at each of its developmental stages: premalignant, at diagnosis, and in relapsed/refractory states. We discuss how these evolutionary concepts can be utilized in the clinic to alter evolutionary trajectories providing a framework for therapeutic intervention at early-disease stages.",2021,Jan,Clin Cancer Res,27,1,15-23,,10.1158/1078-0432.CCR-20-1395,32759358,#1257,Maura 2021,"",""
Mapping kinase domain resistance mechanisms for the MET receptor tyrosine kinase via deep mutational scanning.,Estevam GO; Linossi EM; Rao J; Macdonald CB; Ravikumar A; Chrispens KM; Capra JA; Coyote-Maestas W; Pimentel H; Collisson EA; Jura N; Fraser JS,"Mutations in the kinase and juxtamembrane domains of the MET Receptor Tyrosine Kinase are responsible for oncogenesis in various cancers and can drive resistance to MET-directed treatments. Determining the most effective inhibitor for each mutational profile is a major challenge for MET-driven cancer treatment in precision medicine. Here, we used a deep mutational scan (DMS) of ~5,764 MET kinase domain variants to profile the growth of each mutation against a panel of 11 inhibitors that are reported to target the MET kinase domain. We validate previously identified resistance mutations, pinpoint common resistance sites across type I, type II, and type I ½ inhibitors, unveil unique resistance and sensitizing mutations for each inhibitor, and verify non-cross-resistant sensitivities for type I and type II inhibitor pairs. We augment a protein language model with biophysical and chemical features to improve the predictive performance for inhibitor-treated datasets. Together, our study demonstrates a pooled experimental pipeline for identifying resistance mutations, provides a reference dictionary for mutations that are sensitized to specific therapies, and offers insights for future drug development.",2024,Dec,bioRxiv,,,,,10.1101/2024.07.16.603579,39071407,#1309,Estevam 2024,"",""
Molecular Pathology of Myeloid Neoplasms: Molecular Pattern Recognition.,Sadigh S; Kim AS,"Despite the apparent complexity of the molecular genetic underpinnings of myeloid neoplasms, most myeloid mutational profiles can be understood within a simple framework. Somatic mutations accumulate in hematopoietic stem cells with aging and toxic insults, termed clonal hematopoiesis. These ""old stem cells"" mutations, predominantly in the epigenetic and RNA spliceosome pathways, act as ""founding"" driver mutations leading to a clonal myeloid neoplasm when sufficient in number and clone size. Subsequent mutations can create the genetic flavor of the myeloid neoplasm (""backseat"" drivers) due to their enrichment in certain entities or act as progression events (""aggressive"" drivers) during clonal evolution.",2024,Jun,Clin Lab Med,44,2,339-353,,10.1016/j.cll.2023.08.007,38821648,#1314,Sadigh 2024,"",""
Multi-omics analysis of multiple myeloma patients with differential response to first-line treatment.,Zheng B; Yi K; Zhang Y; Pang T; Zhou J; He J; Lan H; Xian H; Li R,"The genome backgrounds of multiple myeloma (MM) would affect the efficacy of specific treatment. However, the mutational and transcriptional landscapes in MM patients with differential response to first-line treatment remains unclear. We collected paired whole-exome sequencing (WES) and transcriptomic data of over 200 MM cases from MMRF-COMPASS project. R package, maftools was applied to analyze the somatic mutations and mutational signatures across MM samples. Differential expressed genes (DEG) was calculated using R package, DESeq2. The feature selection of the predictive model was determined by LASSO regression. In silico analysis revealed newly discovered recurrent mutated genes such as TTN, MUC16. TP53 mutation was observed more frequent in nonCR (complete remission) group with poor prognosis. DNA repair-associated mutational signatures were enriched in CR patients. Transcriptomic profiling showed that the activity of NF-kappa B and TGF-β pathways was suppressed in CR patients. A transcriptome-based response predictive model was constructed and showed promising predictive accuracy in MM patients receiving first-line treatment. Our study delineated distinctive mutational and transcriptional landscapes in MM patients with differential response to first-line treatment. Furthermore, we constructed a 20-gene predictive model which showed promising accuracy in predicting treatment response in newly diagnosed MM patients.",2023,Nov,Clin Exp Med,23,7,3833-3846,,10.1007/s10238-023-01148-4,37515690,#1331,Zheng 2023,"",""
Small allelic variants are a source of ancestral bias in structural variant breakpoint placement.,Audano PA; Beck CR,"High-quality genome assemblies and sophisticated algorithms have increased sensitivity for a wide range of variant types, and breakpoint accuracy for structural variants (SVs, ≥ 50 bp) has improved to near basepair precision. Despite these advances, many SVs in unique regions of the genome are subject to systematic bias that affects breakpoint location. This ambiguity leads to less accurate variant comparisons across samples, and it obscures true breakpoint features needed for mechanistic inferences. To understand why SVs are not consistently placed, we reanalyzed 64 phased haplotypes constructed from long-read assemblies released by the Human Genome Structural Variation Consortium (HGSVC). We identified variable breakpoints for 882 SV insertions and 180 SV deletions not anchored in tandem repeats (TRs) or segmental duplications (SDs). While this is unexpectedly high for genome assemblies in unique loci, we find read-based callsets from the same sequencing data yielded 1,566 insertions and 986 deletions with inconsistent breakpoints also not anchored in TRs or SDs. When we investigated causes for breakpoint inaccuracy, we found sequence and assembly errors had minimal impact, but we observed a strong effect of ancestry. We confirmed that polymorphic mismatches and small indels are enriched at shifted breakpoints and that these polymorphisms are generally lost when breakpoints shift. Long tracts of homology, such as SVs mediated by transposable elements, increase the likelihood of imprecise SV calls and the distance they are shifted. Tandem Duplication (TD) breakpoints are the most heavily affected SV class with 14% of TDs placed at different locations across haplotypes. While graph genome methods normalize SV calls across many samples, the resulting breakpoints are sometimes incorrect, highlighting a need to tune graph methods for breakpoint accuracy. The breakpoint inconsistencies we characterize collectively affect ~5% of the SVs called in a human genome and underscore a need for algorithm development to improve SV databases, mitigate the impact of ancestry on breakpoint placement, and increase the value of callsets for investigating mutational processes.",2023,Jun,bioRxiv,,,,,10.1101/2023.06.25.546295,37425850,#1333,Audano 2023,"",""
Excerno: Using Mutational Signatures in Sequencing Data to Filter False Variants Caused by Clinical Archival.,Mitchell A; Ruiz M; Yang S; Wang C; Davila JI,"The accurate detection of point mutations from pathology slides using sequencing data is of great importance in cancer genomics and precision oncology. Formalin-fixation paraffin-embedding (FFPE) is a widely used technique to preserve pathology tissues. The FFPE process introduces artificial C > T mutations in next-generation sequencing, so we set out to develop excerno, a method to score and filter such spurious variants. FFPE mutational artifacts follow a mutational signature. By using the FFPE signature and Bayes' formula, we can calculate the probability of a mutation resulting from the FFPE process and use this probability to filter FFPE variants. We implement this method as the excerno R package. We tested excerno by simulating mutations across all 60-baseline mutational signatures from the Catalog of Somatic Mutations in Cancer (COSMIC) and combining them with mutations following the FFPE mutational signature. The sensitivity and specificity of excerno are adversely affected by the cosine similarity between the baseline and FFPE signatures (cosFFPE). Higher percentages of FFPE mutations (pctFFPE) result in increased sensitivity and reduced specificity. The specificity and sensitivity of excerno can be predicted as linear model with an interaction term using cosFFPE and pctFFPE, with an R2of0.84 and 0.79, respectively. Finally, we tested excerno using six RNA sequencing cancer samples and observed concordant trends of specificity and sensitivity with respect to our simulated data. The excerno R package can be used to annotate and filter FFPE-induced mutations in cancer genomics. Our method is adversely affected by cosFFPE and pctFFPE.",2023,Apr,J Comput Biol,30,4,366-375,,10.1089/cmb.2022.0394,36322906,#1353,Mitchell 2023,"",""
A SAMPLING ALGORITHM TO COMPUTE THE SET OF FEASIBLE SOLUTIONS FOR NONNEGATIVE MATRIX FACTORIZATION WITH AN ARBITRARY RANK,"Laursen, R; Hobolth, A","Nonnegative matrix factorization (NMF) is a useful method to extract features from multivariate data, but an important and sometimes neglected concern is that NMF can result in nonunique solutions. Often, there exist a set of feasible solutions (SFS), which makes it more difficult to interpret the factorization. This problem is especially ignored in cancer genomics, where NMF is used to infer information about the mutational processes present in the evolution of cancer. In this paper the extent of nonuniqueness is investigated for two mutational counts data, and a new sampling algorithm that can find the SFS is introduced. Our sampling algorithm is easy to implement and applies to an arbitrary rank of NMF. This is in contrast to state of the art, where the NMF rank must be smaller than or equal to four. For lower ranks we show that our algorithm performs similar to the polygon inflation algorithm that is developed in relation to chemometrics. Furthermore, we show how the size of the SFS can have a high influence on the appearing variability of a solution. Our sampling algorithm is implemented in the R package SFS (https://github.com/ragnhildlaursen/SFS).",2022,,SIAM JOURNAL ON MATRIX ANALYSIS AND APPLICATIONS,43,1,257-273,WOS:000880486100001,10.1137/20M1378971,,#1428,Laursen 2022,"",""
