Title,Authors,Abstract,Published Year,Published Month,Journal,Volume,Issue,Pages,Accession Number,DOI,Ref,Covidence #,Study,Notes,Tags
Precision oncology platforms: practical strategies for genomic database utilization in cancer treatment.,Gazola AA; Lautert-Dutra W; Archangelo LF; Reis RBD; Squire JA,"In recent years, the expansion of molecularly targeted cancer therapies has significantly advanced precision oncology. Parallel developments in next-generation sequencing (NGS) technologies have also improved precision oncology applications, making genomic analysis of tumors more affordable and accessible. Targeted NGS panels now enable the rapid identification of diverse actionable mutations, requiring clinicians to efficiently assess the predictive value of cancer biomarkers for specific treatments. The urgency for timely and accurate decision-making in oncology emphasizes the importance of reliable precision oncology software. Online clinical decision-making tools and associated cancer databases have been designed by consolidating genomic data into standardized, accessible formats. These new platforms are highly integrated and crucial for identifying actionable somatic genomic biomarkers essential for tumor survival, determining corresponding drug targets, and selecting appropriate treatments based on the mutational profile of each patient's tumor. To help oncologists and translational cancer researchers unfamiliar with these tools, we review the utility, accuracy, and comprehensiveness of several commonly used precision medicine software options currently available. Our analysis categorized selected genomic databases based on their primary content, utility, and how well they provide practical guidance for interpreting somatic biomarker data. We identified several comprehensive, mostly open-access platforms that are easy to use for genetic biomarker searches, each with unique features and limitations. Among the precision oncology tools we evaluated, we found MyCancerGenome and OncoKB to be the first choice, offering comprehensive, accurate up-to-date information on the clinical significance of somatic mutations. To illustrate the application of these precision oncology tools in clinical settings, we evaluated three case studies to see how use of the platforms could have influenced treatment planning. Most of the precision oncology software evaluated could be easily streamlined into clinical workflows to provide updated information on approved drugs and clinical trials related the actionable mutations detected. Some platforms were very intuitive and easy to use, while others, often developed in smaller academic settings, were more difficult to navigate and may not be updated consistently. Future enhancements, incorporating artificial intelligence algorithms, are likely to improve integration of the platforms with diverse big data sources, enabling more accurate predictions of potential therapeutic responses.",2024,Nov,Mol Cytogenet,17,1,28,,10.1186/s13039-024-00698-w,39543667,#436,Gazola 2024,"",""
Decision of the Optimal Rank of a Nonnegative Matrix Factorization Model for Gene Expression Data Sets Utilizing the Unit Invariant Knee Method: Development and Evaluation of the Elbow Method for Rank Selection.,Guven E,"BACKGROUND: There is a great need to develop a computational approach to analyze and exploit the information contained in gene expression data. The recent utilization of nonnegative matrix factorization (NMF) in computational biology has demonstrated the capability to derive essential details from a high amount of data in particular gene expression microarrays. A common problem in NMF is finding the proper number rank (r) of factors of the degraded demonstration, but no agreement exists on which technique is most appropriate to utilize for this purpose. Thus, various techniques have been suggested to select the optimal value of rank factorization (r). OBJECTIVE: In this work, a new metric for rank selection is proposed based on the elbow method, which was methodically compared against the cophenetic metric. METHODS: To decide the optimum number rank (r), this study focused on the unit invariant knee (UIK) method of the NMF on gene expression data sets. Since the UIK method requires an extremum distance estimator that is eventually employed for inflection and identification of a knee point, the proposed method finds the first inflection point of the curvature of the residual sum of squares of the proposed algorithms using the UIK method on gene expression data sets as a target matrix. RESULTS: Computation was conducted for the UIK task using gene expression data of acute lymphoblastic leukemia and acute myeloid leukemia samples. Consequently, the distinct results of NMF were subjected to comparison on different algorithms. The proposed UIK method is easy to perform, fast, free of a priori rank value input, and does not require initial parameters that significantly influence the model's functionality. CONCLUSIONS: This study demonstrates that the elbow method provides a credible prediction for both gene expression data and for precisely estimating simulated mutational processes data with known dimensions. The proposed UIK method is faster than conventional methods, including metrics utilizing the consensus matrix as a criterion for rank selection, while achieving significantly better computational efficiency without visual inspection on the curvatives. Finally, the suggested rank tuning method based on the elbow method for gene expression data is arguably theoretically superior to the cophenetic measure.",2023,Jun,JMIR Bioinform Biotechnol,4,,e43665,,10.2196/43665,38935969,#445,Guven 2023,"",""
Gene mutations of esophageal squamous cell carcinoma based on next-generation sequencing.,Wang L; Jia YM; Zuo J; Wang YD; Fan ZS; Feng L; Zhang X; Han J; Lyu WJ; Ni ZY,"BACKGROUND: Esophageal squamous cell carcinoma (ESCC) is one of the most aggressive cancers without effective therapy. To explore potential molecular targets in ESCC, we quantified the mutation spectrum and explored the relationship between gene mutation and clinicopathological characteristics and programmed death-ligand 1 (PD-L1) expression. METHODS: Between 2015 and 2019, 29 surgically resected ESCC tissues and adjacent normal tissues from the Fourth Hospital of Hebei Medical University were subjected to targeted next-generation sequencing. The expression levels of PD-L1 were detected by immunohistochemistry. Mutational signatures were extracted from the mutation count matrix by using non-negative matrix factorization. The relationship between detected genomic alterations and clinicopathological characteristics and PD-L1 expression was estimated by Spearman rank correlation analysis. RESULTS: The most frequently mutated gene was TP53 (96.6%, 28/29), followed by NOTCH1 (27.6%, 8/29), EP300 (17.2%, 5/29), and KMT2C (17.2%, 5/29). The most frequently copy number amplified and deleted genes were CCND1/FGF3/FGF4/FGF19 (41.4%, 12/29) and CDKN2A/2B (10.3%, 3/29). By quantifying the contribution of the mutational signatures to the mutation spectrum, we found that the contribution of signature 1, signature 2, signature 10, signature 12, signature 13, and signature 17 was relatively high. Further analysis revealed genetic variants associated with cell cycle, chromatin modification, Notch, and Janus kinase-signal transducer and activator of transcription signaling pathways, which may be key pathways in the development and progression of ESCC. Evaluation of PD-L1 expression in samples showed that 13.8% (4/29) of samples had tumor proportion score ≥1%. 17.2% (5/29) of patients had tumor mutation burden (TMB) above 10 mut/Mb. All samples exhibited microsatellite stability. TMB was significantly associated with lymph node metastasis (r = 0.468, P = 0.010), but not significantly associated with PD-L1 expression (r = 0.246, P = 0.198). There was no significant correlation between PD-L1 expression and detected gene mutations (all P > 0.05). CONCLUSION: Our research initially constructed gene mutation profile related to surgically resected ESCC in high-incidence areas to explore the mechanism underlying ESCC development and potential therapeutic targets.",2021,Feb,Chin Med J (Engl),134,6,708-715,,10.1097/CM9.0000000000001411,33725708,#447,Wang 2021,"",""
Zeste White 10 May Serve as a Prognostic Biomarker and Therapeutic Target for Human Breast Cancer.,Bellah SF; Hossen MA; Billah SS; Durojaye OA; Raihan MO,"BACKGROUND: Zeste White 10 (ZW10) is a key component of the spindle assembly checkpoint (SAC) that maintains chromosomal stability during mitosis. Dysregulation of ZW10 can cause chromosomal instability and aneuploidy-hallmarks of many cancers, including breast cancer, particularly triple-negative breast cancer (TNBC). However, its prognostic and therapeutic relevance in breast cancer remains unclear. OBJECTIVES: This study aimed to systematically investigate the expression pattern, prognostic significance, mutational profile, and immune associations of ZW10 in breast cancer using integrated omics data. DESIGN: A computational, cross-cohort bioinformatics analysis combining transcriptomic, proteomic, mutational, and clinical data from publicly available databases. METHODS: The ZW10 expression levels were assessed across normal and cancerous tissues using The Cancer Genome Atlas (TCGA), Genotype-Tissue Expression (GTEx), and the Human Protein Atlas data sets. Immune infiltration correlations were analyzed using TIMER2.0, Gene Set Cancer Analysis (GSCA), and TNMplot. Survival analyses were performed using Kaplan-Meier Plotter and TCGA clinical data sets. Protein-protein interaction (PPI) and functional enrichment analyses were conducted using STRING and EnrichR, and mutation data were retrieved from COSMIC and cBioPortal. RESULTS: The ZW10 expression was markedly upregulated across multiple cancers, with the highest expression in TNBC. Elevated ZW10 levels correlated with immune cell infiltration and adverse overall survival, while lower ZW10 expression predicted improved relapse-free survival. Protein-protein interaction and enrichment analyses revealed ZW10's close interaction with key mitotic regulators and its involvement in spindle checkpoint and vesicular trafficking pathways. Mutation analysis identified predominant A > G and A > T substitutions and frequent gene amplifications across malignancies. CONCLUSION: The ZW10 acts as a potential prognostic biomarker and therapeutic target in breast cancer, particularly TNBC, through its dual roles in mitotic regulation and immune modulation. Further experimental validation is warranted to confirm its mechanistic role and therapeutic potential.",2026,,Breast Cancer (Auckl),20,,11782234261428784,,10.1177/11782234261428784,41836220,#451,Bellah 2026,"",""
DNA Repair Footprint Uncovers Contribution of DNA Repair Mechanism to Mutational Signatures.,Wojtowicz D; Leiserson MDM; Sharan R; Przytycka TM,"Cancer genomes accumulate a large number of somatic mutations resulting from imperfection of DNA processing during normal cell cycle as well as from carcinogenic exposures or cancer related aberrations of DNA maintenance machinery. These processes often lead to distinctive patterns of mutations, called mutational signatures. Several computational methods have been developed to uncover such signatures from catalogs of somatic mutations. However, cancer mutational signatures are the end-effect of several interplaying factors including carcinogenic exposures and potential deficiencies of the DNA repair mechanism. To fully understand the nature of each signature, it is important to disambiguate the atomic components that contribute to the final signature. Here, we introduce a new descriptor of mutational signatures, DNA Repair FootPrint (RePrint), and show that it can capture common properties of deficiencies in repair mechanisms contributing to diverse signatures. We validate the method with published mutational signatures from cell lines targeted with CRISPR-Cas9-based knockouts of DNA repair genes.",2020,,Pac Symp Biocomput,25,,262-273,,,31797602,#463,Wojtowicz 2020,"",""
Graph convolution networks model identifies and quantifies gene and cancer specific transcriptome signatures of cancer driver events.,Ben Cohen G; Yaacov A; Ben Zvi Y; Loutati R; Lishinsky N; Landau J; Hope T; Popovzter A; Rosenberg S,"BACKGROUND: The identification and drug targeting of cancer causing (driver) genetic alterations has seen immense improvement in recent years, with many new targeted therapies developed. However, identifying, prioritizing, and treating genetic alterations is insufficient for most cancer patients. Current clinical practices rely mainly on DNA level mutational analyses, which in many cases fail to identify treatable driver events. Arguably, signal strength may determine cell fate more than the mutational status that initiated it. The use of transcriptomics, a complex and highly informative representation of cellular and tumor state, had been suggested to enhance diagnostics and treatment successes. A gene-expression based model trained over known genetic alterations could improve identification and quantification of cancer related biological aberrations' signal strength. METHODS: We present STAMP (Signatures in Transcriptome Associated with Mutated Protein), a Graph Convolution Networks (GCN) based framework for the identification of gene expression signatures related to cancer driver events. STAMP was trained to identify the p53 dysfunction of cancer samples from gene expression, utilizing comprehensive curated graph structures of gene interactions. Predictions were modified for generating a quantitative score to rank the severity of a driver event in each sample. STAMP was then extended to almost 300 tumor type-specific predictive models for important cancer genes/pathways, by training to identify well-established driver events' annotations from the literature. RESULTS: STAMP achieved very high AUC on unseen data across several tumor types and on an independent cohort. The framework was validated on p53 related genetic and clinical characteristics, including the effect of Variants of Unknown Significance, and showed strong correlation with protein function. For genes and tumor types where targeted therapy is available, STAMP showed correlation with drugs sensitivity (IC50) in an independent cell line database. It managed to stratify drug effect on samples with similar mutational profiles. STAMP was validated for drug-response prediction in clinical patients' cohorts, improving over a state-of-the-art method and suggesting potential biomarkers for cancer treatments. CONCLUSIONS: The STAMP models provide a learning framework that successfully identifies and quantifies driver events' signal strength, showing utility in portraying the molecular landscape of tumors based on transcriptomics. Importantly, STAMP manifested the ability to improve targeted therapy selection and hence can contribute to better treatment.",2025,Feb,Comput Biol Med,185,,109491,,10.1016/j.compbiomed.2024.109491,39700860,#464,BenCohen 2025,"",""
Copy number signature analysis tool and its application in prostate cancer reveals distinct mutational processes and clinical outcomes.,Wang S; Li H; Song M; Tao Z; Wu T; He Z; Zhao X; Wu K; Liu XS,"Genome alteration signatures reflect recurring patterns caused by distinct endogenous or exogenous mutational events during the evolution of cancer. Signatures of single base substitution (SBS) have been extensively studied in different types of cancer. Copy number alterations are important drivers for the progression of multiple cancer. However, practical tools for studying the signatures of copy number alterations are still lacking. Here, a user-friendly open source bioinformatics tool ""sigminer"" has been constructed for copy number signature extraction, analysis and visualization. This tool has been applied in prostate cancer (PC), which is particularly driven by complex genome alterations. Five copy number signatures are identified from human PC genome with this tool. The underlying mutational processes for each copy number signature have been illustrated. Sample clustering based on copy number signature exposure reveals considerable heterogeneity of PC, and copy number signatures show improved PC clinical outcome association when compared with SBS signatures. This copy number signature analysis in PC provides distinct insight into the etiology of PC, and potential biomarkers for PC stratification and prognosis.",2021,May,PLoS Genet,17,5,e1009557,,10.1371/journal.pgen.1009557,33945534,#469,Wang 2021,"",""
EvoLSTM: context-dependent models of sequence evolution using a sequence-to-sequence LSTM.,Lim D; Blanchette M,"MOTIVATION: Accurate probabilistic models of sequence evolution are essential for a wide variety of bioinformatics tasks, including sequence alignment and phylogenetic inference. The ability to realistically simulate sequence evolution is also at the core of many benchmarking strategies. Yet, mutational processes have complex context dependencies that remain poorly modeled and understood. RESULTS: We introduce EvoLSTM, a recurrent neural network-based evolution simulator that captures mutational context dependencies. EvoLSTM uses a sequence-to-sequence long short-term memory model trained to predict mutation probabilities at each position of a given sequence, taking into consideration the 14 flanking nucleotides. EvoLSTM can realistically simulate mammalian and plant DNA sequence evolution and reveals unexpectedly strong long-range context dependencies in mutation probabilities. EvoLSTM brings modern machine-learning approaches to bear on sequence evolution. It will serve as a useful tool to study and simulate complex mutational processes. AVAILABILITY AND IMPLEMENTATION: Code and dataset are available at https://github.com/DongjoonLim/EvoLSTM. SUPPLEMENTARY INFORMATION: Supplementary data are available at Bioinformatics online.",2020,Jul,Bioinformatics,36,Suppl_1,i353-i361,,10.1093/bioinformatics/btaa447,32657367,#474,Lim 2020,"",""
Pan-cancer identification of clinically relevant genomic subtypes using outcome-weighted integrative clustering.,Arora A; Olshen AB; Seshan VE; Shen R,"BACKGROUND: Comprehensive molecular profiling has revealed somatic variations in cancer at genomic, epigenomic, transcriptomic, and proteomic levels. The accumulating data has shown clearly that molecular phenotypes of cancer are complex and influenced by a multitude of factors. Conventional unsupervised clustering applied to a large patient population is inevitably driven by the dominant variation from major factors such as cell-of-origin or histology. Translation of these data into clinical relevance requires more effective extraction of information directly associated with patient outcome. METHODS: Drawing from ideas in supervised text classification, we developed survClust, an outcome-weighted clustering algorithm for integrative molecular stratification focusing on patient survival. survClust was performed on 18 cancer types across multiple data modalities including somatic mutation, DNA copy number, DNA methylation, and mRNA, miRNA, and protein expression from the Cancer Genome Atlas study to identify novel prognostic subtypes. RESULTS: Our analysis identified the prognostic role of high tumor mutation burden with concurrently high CD8 T cell immune marker expression and the aggressive clinical behavior associated with CDKN2A deletion across cancer types. Visualization of somatic alterations, at a genome-wide scale (total mutation burden, mutational signature, fraction genome altered) and at the individual gene level, using circomap further revealed indolent versus aggressive subgroups in a pan-cancer setting. CONCLUSIONS: Our analysis has revealed prognostic molecular subtypes not previously identified by unsupervised clustering. The algorithm and tools we developed have direct utility toward patient stratification based on tumor genomics to inform clinical decision-making. The survClust software tool is available at https://github.com/arorarshi/survClust .",2020,Dec,Genome Med,12,1,110,,10.1186/s13073-020-00804-8,33272320,#491,Arora 2020,"",""
Comprehensive single-cell genome analysis at nucleotide resolution using the PTA Analysis Toolbox.,Middelkamp S; Manders F; Peci F; van Roosmalen MJ; González DM; Bertrums EJM; van der Werf I; Derks LLM; Groenen NM; Verheul M; Trabut L; Pleguezuelos-Manzano C; Brandsma AM; Antoniou E; Reinhardt D; Bierings M; Belderbos ME; van Boxtel R,"Detection of somatic mutations in single cells has been severely hampered by technical limitations of whole-genome amplification. Novel technologies including primary template-directed amplification (PTA) significantly improved the accuracy of single-cell whole-genome sequencing (WGS) but still generate hundreds of artifacts per amplification reaction. We developed a comprehensive bioinformatic workflow, called the PTA Analysis Toolbox (PTATO), to accurately detect single base substitutions, insertions-deletions (indels), and structural variants in PTA-based WGS data. PTATO includes a machine learning approach and filtering based on recurrence to distinguish PTA artifacts from true mutations with high sensitivity (up to 90%), outperforming existing bioinformatic approaches. Using PTATO, we demonstrate that hematopoietic stem cells of patients with Fanconi anemia, which cannot be analyzed using regular WGS, have normal somatic single base substitution burdens but increased numbers of deletions. Our results show that PTATO enables studying somatic mutagenesis in the genomes of single cells with unprecedented sensitivity and accuracy.",2023,Sep,Cell Genom,3,9,100389,,10.1016/j.xgen.2023.100389,37719152,#502,Middelkamp 2023,"",""
De novo detection of somatic variants in high-quality long-read single-cell RNA sequencing data.,Dondi A; Borgsmüller N; Ferreira PF; Haas BJ; Jacob F; Heinzelmann-Schwarz V; Beerenwinkel N,"In cancer, genetic and transcriptomic variations generate clonal heterogeneity, leading to treatment resistance. Long-read single-cell RNA sequencing (LR scRNA-seq) has the potential to detect genetic and transcriptomic variations simultaneously. Here, we present LongSom, a computational workflow leveraging high-quality LR scRNA-seq data to call de novo somatic single-nucleotide variants (SNVs), including in mitochondria (mtSNVs), copy number alterations (CNAs), and gene fusions, to reconstruct the tumor clonal heterogeneity. Before somatic variant calling, LongSom reannotates marker gene-based cell types using cell mutational profiles. LongSom distinguishes somatic SNVs from noise and germline polymorphisms by applying an extensive set of hard filters and statistical tests. Applying LongSom to human ovarian cancer samples, we detected clinically relevant somatic SNVs that were validated against matched DNA samples. Leveraging somatic SNVs and fusions, LongSom found subclones with different predicted treatment outcomes. In summary, LongSom enables de novo variant detection without the need for normal samples, facilitating the study of cancer evolution, clonal heterogeneity, and treatment resistance.",2025,Apr,Genome Res,35,4,900-913,,10.1101/gr.279281.124,40107722,#511,Dondi 2025,"",""
De novo detection of somatic variants in high-quality long-read single-cell RNA sequencing data.,Dondi A; Borgsmüller N; Ferreira PF; Haas BJ; Jacob F; Heinzelmann-Schwarz V; Beerenwinkel N,"In cancer, genetic and transcriptomic variations generate clonal heterogeneity, leading to treatment resistance. Long-read single-cell RNA sequencing (LR scRNA-seq) has the potential to detect genetic and transcriptomic variations simultaneously. Here, we present LongSom, a computational workflow leveraging high-quality LR scRNA-seq data to call de novo somatic single-nucleotide variants (SNVs), including in mitochondria (mtSNVs), copy-number alterations (CNAs), and gene fusions, to reconstruct the tumor clonal heterogeneity. Before somatic variants calling, LongSom re-annotates marker gene based cell types using cell mutational profiles. LongSom distinguishes somatic SNVs from noise and germline polymorphisms by applying an extensive set of hard filters and statistical tests. Applying LongSom to human ovarian cancer samples, we detected clinically relevant somatic SNVs that were validated against matched DNA samples. Leveraging somatic SNVs and fusions, LongSom found subclones with different predicted treatment outcomes. In summary, LongSom enables de novo variants detection without the need for normal samples, facilitating the study of cancer evolution, clonal heterogeneity, and treatment resistance.",2024,Nov,bioRxiv,,,,,10.1101/2024.03.06.583775,38496441,#512,Dondi 2024,"",""
